user_screen_name,id,user_id,source,created_at,retweet_count,favorite_count,text,in_reply_to_screen_name,in_reply_to_status_id,retweeted_status_id,retweeted_status_user_id,retweeted_status_user_screen_name
repwestmoreland,557741273457897472,137407124,Twitter Web Client,2015-01-21 03:27:36,1,1,HAPPENING NOW: @SenJoniErnst is delivering the Republican #SOTU2015 Address.,,,,,
repwestmoreland,557739358766514178,137407124,Twitter Web Client,2015-01-21 03:20:00,1,1,The pres's speech tonight proves how out of touch he is with the American people's priorities. My #SOTU2015 response: http://t.co/TWryhetKFA,,,,,
repwestmoreland,557737101975121920,137407124,Twitter Web Client,2015-01-21 03:11:02,8,3,"Did the prez not hear the people in the 2014 elections? We dont want more taxes, we want solutions for all Americans #Jobs #SOTU2015",,,,,
repwestmoreland,557735322529054720,137407124,Twitter Web Client,2015-01-21 03:03:57,4,0,"RT @michael_steel: FACT: House Republicans have led on cyber-security, while Washington Democrats have dithered. http://t.co/Tx3vjQtYip",,,557734354768912385,107441863,michael_steel
repwestmoreland,557734834236567552,137407124,Twitter Web Client,2015-01-21 03:02:01,1,4,"Back in Nov, I expressed my concern with prisoner transfers from Guantanamo &amp; the threat to our national security --&gt; http://t.co/opLixX1QIQ",,,,,
repwestmoreland,557732203808161792,137407124,Twitter Web Client,2015-01-21 02:51:34,2,0,Cyberterrorism could be our next Pearl Harbor. Strengthening our cybersecurity needs to remain a crucial role in protecting our nation #SOTU,,,,,
repwestmoreland,557730737131372544,137407124,Twitter Web Client,2015-01-21 02:45:44,6,3,Prez's foreign policy record is embarrassing. We need to stand with &amp; support for our allies (France) &amp; use more force against terrorists.,,,,,
repwestmoreland,557730235744268290,137407124,Twitter Web Client,2015-01-21 02:43:44,47,34,"Raising taxes doesn't create jobs. We need to focus on cutting spending, reducing the debt, and getting Americans to work. #SOTU2015",,,,,
repwestmoreland,557730129166995456,137407124,Twitter Web Client,2015-01-21 02:43:19,12,6,"If the president wants to help simplify our tax code, he can start by reviewing proposals for #FairTax bill &amp; abolishing the IRS. #SOTU2015",,,,,
repwestmoreland,557729977987514369,137407124,Twitter Web Client,2015-01-21 02:42:43,3,6,"Our country does not have a revenue problem, we have a spending problem. Getting spending under control is the way to address the $18T debt.",,,,,
repwestmoreland,557727257595490306,137407124,Twitter Web Client,2015-01-21 02:31:54,447,369,"So ""free"" college will be paid for by taxing 529 plans, or parent’s college savings funds? Doesn't sound so free anymore. #SOTU2015",,,,,
repwestmoreland,557724282491797504,137407124,Twitter Web Client,2015-01-21 02:20:05,67,0,RT @HouseGOP: The President can't take credit for America's #EnergyBoom. #SOTU http://t.co/X2IXvVcBmE,,,557724217710739456,15207668,HouseGOP
repwestmoreland,557723065153761281,137407124,Twitter Web Client,2015-01-21 02:15:15,6,4,"If the president wants to find solutions for all Americans, he needs to work WITH congress, not continue to go around it. #SOTU2015",,,,,
repwestmoreland,557714995686166530,137407124,Twitter Web Client,2015-01-21 01:43:11,75,0,RT @SenJoniErnst: Tune in tonight to watch the Republican Address following the #SOTU http://t.co/UT69VJRZTZ http://t.co/QeRaZZrpv7,,,557673055779319809,2856787757,SenJoniErnst
repwestmoreland,557714682157740032,137407124,Twitter Web Client,2015-01-21 01:41:56,29,0,RT @SpeakerBoehner: You can watch President Obama’s #SOTU &amp; then @SenJoniErnst’s Republican address right here: http://t.co/CQgbxTPnmc,,,557712418269585408,7713202,SpeakerBoehner
repwestmoreland,557619258193362944,137407124,Twitter Web Client,2015-01-20 19:22:45,0,1,We must stand with our allies and show strength in the face of global terrorism in order to defeat it --&gt; http://t.co/yaCaJBUq93,,,,,
repwestmoreland,555837291714064385,137407124,Twitter Web Client,2015-01-15 21:21:51,5,0,RT @TimesHerald: Opinion: @RepWestmoreland speaks about the passage of major bills in the first week back. http://t.co/on8WC9uSOd,,,555836912561561600,16445311,TimesHerald
repwestmoreland,555439292059627520,137407124,TweetDeck,2015-01-14 19:00:21,4,1,The @DeptVetAffairs is accepting applications for the 35th Annual National Wheelchair Games. Learn more here: http://t.co/33wIynxam0,,,,,
repwestmoreland,555415482363551745,137407124,Twitter Web Client,2015-01-14 17:25:44,0,1,@parsigma06 please give my Newnan office a call at 770-683-2033 to see if we can help,parsigma06,555414961124417537,,,
repwestmoreland,555412559944511488,137407124,Twitter Web Client,2015-01-14 17:14:08,37,0,"RT @HouseBenghazi: Update: This week, the #Benghazi Cmt held closed meetings w/ State Dept and DOJ. MORE: http://t.co/OINZpElpJd",,,555410300405432320,2786564756,HouseBenghazi
repwestmoreland,555412056468643840,137407124,Twitter Web Client,2015-01-14 17:12:07,3,3,I just voted for the 2015 DHS Appropriations Act to prevent executive amnesty &amp; fund the DHS --&gt;http://t.co/i9d37xaQnn,,,,,
repwestmoreland,555397487402684416,137407124,Twitter Web Client,2015-01-14 16:14:14,1,0,"This morning, I remembered my friend, Mr. Robert Jordan of Fayetteville, on the @HouseFloor. Watch my speech here: http://t.co/itU2Aw4EoY",,,,,
repwestmoreland,555391261797269504,137407124,Twitter Web Client,2015-01-14 15:49:30,4,0,RT @FinancialCmte: Chairman @RepHensarling Welcomes @FinancialCmte Sub Chairs @RepGarrett @RandyNeugebauer @RepBlainePress http://t.co/zjl7…,,,555391158609006594,42924141,FinancialCmte
repwestmoreland,555370592577548288,137407124,Twitter Web Client,2015-01-14 14:27:22,2,0,"ICYMI #jobs @AtlBizChron: ""Georgia to tackle film worker shortage with academy"" http://t.co/Lwf1GSSIZw",,,,,
repwestmoreland,555077824412131328,137407124,Twitter Web Client,2015-01-13 19:04:00,4,1,TUNE IN: I'm presiding on the @HouseFloor as Speaker Pro Tempore. Watch it live here --&gt; http://t.co/piJ7Hem3c9,,,,,
repwestmoreland,554732050612518912,137407124,Twitter Web Client,2015-01-12 20:10:01,3,1,Good luck Mackenna! ICYMI @wsbtv: Teen running 100+ miles in memory of fallen officers --&gt; http://t.co/1HFccN6dqJ,,,,,
repwestmoreland,554676757639331840,137407124,TweetDeck,2015-01-12 16:30:19,3,4,Congratulations to @GovernorDeal on his inauguration today! Best wishes to you and @GAFirstLady on this special day. #gapol,,,,,
repwestmoreland,554665320011796480,137407124,Twitter Web Client,2015-01-12 15:44:52,18,0,RT @GOPLeader: Here is this week's @HouseFloor schedule: http://t.co/sTTD0KnwxV,,,554665167288799233,19739126,GOPLeader
repwestmoreland,554660227640221696,137407124,Twitter Web Client,2015-01-12 15:24:38,1,0,"If these first two weeks are any indication, 2015 could be Obama's year of the veto threats --&gt; http://t.co/gNYWQaDY5O",,,,,
repwestmoreland,554657094750961664,137407124,Twitter Web Client,2015-01-12 15:12:11,5,3,We must all stand together against terrorism. The administration should have sent a top official to France to stand in support w/ our allies,,,,,
repwestmoreland,553616744489971712,137407124,Twitter Web Client,2015-01-09 18:18:12,5,1,This week the House passed jobs bills that work for all Americans --&gt; http://t.co/tueIOZed7u #40HourWorkWeek #KeystoneXL #HireMoreHeroes,,,,,
repwestmoreland,553611789364375552,137407124,Twitter Web Client,2015-01-09 17:58:30,2,3,"In 2014 my office answered 19,033 letters/emails &amp; helped 1,094 constituents w/ casework http://t.co/aecYFztHVK #GA03 http://t.co/Cko4cce37k",,,,,
repwestmoreland,553569845976268800,137407124,Twitter Web Client,2015-01-09 15:11:50,5,7,Thankful for the those who keep our communities safe everyday. #NationalLawEnforcementAppreciationDay,,,,,
repwestmoreland,553279009120063488,137407124,Twitter for iPhone,2015-01-08 19:56:09,5,5,Received this Army seal for my office today. Another reminder to be grateful those who have &amp; do serve our nation. http://t.co/hTyHy9wLDp,,,,,
repwestmoreland,552574391994023937,137407124,Twitter Web Client,2015-01-06 21:16:16,6,6,Great news for #GA! @MercedesBenz is moving its headquarters to Atlanta. From @ajc: http://t.co/4IBVAk3ouS #jobs,,,,,
repwestmoreland,552105079764180992,137407124,Twitter Web Client,2015-01-05 14:11:23,3,0,"New Year, new Republican Congress --&gt; http://t.co/Jxin0phpqM",,,,,
repwestmoreland,550755011488395265,137407124,Twitter for iPhone,2015-01-01 20:46:41,42,0,"RT @SpeakerBoehner: Updated: In 2014, @WashingtonPost #FactChecker awarded Pres Obama 49 Pinocchios, plus one Upside-Down Pinocchio → http:…",,,550362431382642689,7713202,SpeakerBoehner
repwestmoreland,550664042092560384,137407124,TweetDeck,2015-01-01 14:45:13,0,5,Happy New Year! Looking forward to 2015 and serving the good people of #GA03. http://t.co/32OVkFJ5Ag,,,,,
repwestmoreland,548131119615336448,137407124,TweetDeck,2014-12-25 15:00:17,1,4,Joan and I wish you a very Merry Christmas and a Happy New Year! http://t.co/HspVC6F21O,,,,,
repwestmoreland,545944008808484864,137407124,Twitter Web Client,2014-12-19 14:09:29,1,2,I was honored to be the commencement speaker at West Georgia Technical College's graduation. Congrats to the grads! http://t.co/b780s1e986,,,,,
repwestmoreland,545670369865367552,137407124,Twitter Web Client,2014-12-18 20:02:08,5,2,Great news for #GA03! Hyundai Glovis Georgia to create 190 #jobs in Harris County --&gt; http://t.co/XO8sQH7Pw6,,,,,
repwestmoreland,543121386001424384,137407124,Twitter Web Client,2014-12-11 19:13:23,17,0,RT @RepMarthaRoby: Troubling finding at today's Benghazi hearing: guards at high-risk posts still not being properly vetted http://t.co/JZI…,,,542754608658268160,224294785,RepMarthaRoby
repwestmoreland,543120790812913664,137407124,Twitter Web Client,2014-12-11 19:11:01,17,0,RT @loudobbsnews: .@RepWestmoreland on why the #Benghazi Select Cmte must push ahead. http://t.co/1SZoSNBPYf http://t.co/dSZZQntmbD,,,543099213018443776,26487169,loudobbsnews
repwestmoreland,543081983686225920,137407124,Twitter Web Client,2014-12-11 16:36:49,5,2,This morning I thanked GA @NRECAintl volunteers for their work in Costa Rica on the @HouseFloor. Watch it here --&gt; http://t.co/KKMpawRrzV,,,,,
repwestmoreland,543042480976183297,137407124,Twitter Web Client,2014-12-11 13:59:51,0,2,"I'm heading to the @HouseFloor to thank Phil Hogan, Josh Allen, James Weston Abbott &amp; Shea Lasseter for their volunteer work in Costa Rica.",,,,,
repwestmoreland,542869842223968256,137407124,Twitter for iPhone,2014-12-11 02:33:51,7,0,"RT @loudobbsnews: On #LouDobbsTonight are @RepWestmoreland, @SheriffClarke, @AmbJohnBolton, @LisaMarieBoothe &amp; @thehill's AB Stoddard 10PM …",,,542868935763177472,26487169,loudobbsnews
repwestmoreland,542822669734137857,137407124,Twitter for iPhone,2014-12-10 23:26:24,6,2,"TUNE IN: Tonight at 7pm, I'll be joining @loudobbsnews to discuss today's #Benghazi hearing. http://t.co/YnYQMaoR3O",,,,,
repwestmoreland,542789691373010945,137407124,Twitter Web Client,2014-12-10 21:15:21,2,1,Here's my full statement on today's #Benghazi hearing --&gt; http://t.co/oKERPlaAgZ,,,,,
repwestmoreland,542787587929571328,137407124,Twitter Web Client,2014-12-10 21:07:00,9,0,"RT @SenatorIsakson: In just a few minutes, my good friend @SaxbyChambliss will be giving his farewell address via @cspan. Watch live: http:…",,,542787317853745152,78403308,SenatorIsakson
repwestmoreland,542751814521995265,137407124,Twitter Web Client,2014-12-10 18:44:51,24,26,Good luck to the @UWGAthletics football team as they travel to Colorado for the Semi Finals of the Division 2 playoffs on Saturday!,,,,,
repwestmoreland,542733708076544000,137407124,Twitter Web Client,2014-12-10 17:32:54,9,8,Watch the videos of my questioning the @HouseBenghazi hearing witnesses here: http://t.co/tNy0JgCjB8 and here: http://t.co/0dJYokd7Gv,,,,,
repwestmoreland,542713341048025089,137407124,Twitter Web Client,2014-12-10 16:11:58,2,1,LIVE: I'm questioning the witnesses at the @HouseBenghazi hearing. Watch on CSPAN-3 http://t.co/zpox23MLnj or at http://t.co/CAxrOuk95V .,,,,,
repwestmoreland,542696522064740355,137407124,TweetDeck,2014-12-10 15:05:08,3,2,HAPPENING NOW: Watch the @HouseBenghazi's second hearing LIVE on C-SPAN3 http://t.co/pVArQdY5tK or at http://t.co/jgncvA9PY4.,,,,,
repwestmoreland,542691484294578177,137407124,TweetDeck,2014-12-10 14:45:07,1,2,TUNE IN: I look forward to questioning the witnesses on embassy security at the @HouseBenghazi hearing at 10am. http://t.co/DKGYY9KKRr,,,,,
repwestmoreland,542682712101105664,137407124,Twitter Web Client,2014-12-10 14:10:15,1,1,@Praying4_GA Thank you.,Praying4_GA,542648386571100163,,,
repwestmoreland,542682598775226368,137407124,Twitter Web Client,2014-12-10 14:09:48,18,0,"RT @cspan: .@HouseBenghazi Cmte hearing, @TGowdySC chairs – LIVE at 10am ET on C-SPAN3 http://t.co/tzzZvHN88T #Benghazi http://t.co/JPMGWgW…",,,542680827344470016,15675138,cspan
repwestmoreland,542680175167537153,137407124,TweetDeck,2014-12-10 14:00:10,1,2,"TUNE IN: At 10am, the @HouseBenghazi will hold its second hearing. Watch live at http://t.co/ezjsjJePKp http://t.co/pa0Ww7HAg5",,,,,
repwestmoreland,542330422584414208,137407124,Twitter Web Client,2014-12-09 14:50:23,22,0,RT @GOPoversight: Now underway: CMS Admin Tavenner and #ObamaCare architect Johnathan Gruber testify before the Committee. http://t.co/N7aU…,,,542329831934148608,22508473,GOPoversight
repwestmoreland,542026627245690880,137407124,Twitter Web Client,2014-12-08 18:43:12,0,0,This Saturday is the Hamilton Christmas Parade in Harris County! More info on their Facebook invite --&gt; http://t.co/vngc3hHJ5u @hcgachamber,,,,,
repwestmoreland,542000917898596353,137407124,Twitter Web Client,2014-12-08 17:01:03,1,0,"Ash Carter has a big, international clean up job ahead of him if confirmed as Sec of the DoD. --&gt; http://t.co/b5BnEHed0L",,,,,
repwestmoreland,541640068717236224,137407124,TweetDeck,2014-12-07 17:07:10,3,7,America Remembers. #PearlHarbor http://t.co/649Q7CXSLA,,,,,
repwestmoreland,540879867190206464,137407124,Twitter Web Client,2014-12-05 14:46:24,58,0,RT @HouseBenghazi: Next #Benghazi public hearing scheduled for Dec 10: http://t.co/0nqrYshcAq,,,540192519699439617,2786564756,HouseBenghazi
repwestmoreland,540879831643480065,137407124,Twitter Web Client,2014-12-05 14:46:15,106,0,RT @HouseBenghazi: New video “1999”— Committee to examine efforts to secure our diplomatic facilities. Hearing 12/10: http://t.co/jAQe0teIhJ,,,540874491203579905,2786564756,HouseBenghazi
repwestmoreland,540879579595149312,137407124,Twitter Web Client,2014-12-05 14:45:15,31,23,"On December 10, @HouseBenghazi will hold its second hearing. Learn more &amp; watch it live at http://t.co/zpYQ7piRom. http://t.co/UxnszcV0vI",,,,,
repwestmoreland,540600881394507776,137407124,Twitter Web Client,2014-12-04 20:17:48,5,6,I voted yes on House bill to stop executive overreach on immigration by the president. Pres cannot act alone on this. http://t.co/W56R7mHwUI,,,,,
repwestmoreland,540589840270884865,137407124,Twitter Web Client,2014-12-04 19:33:56,1115,0,RT @AP: BREAKING: House passes bill declaring Obama's immigration executive actions `null and void',,,540589658019987456,51241574,AP
repwestmoreland,540544245665656832,137407124,Twitter Web Client,2014-12-04 16:32:45,0,0,@jaseliberty Of course!,jaseliberty,540542709941825536,,,
repwestmoreland,540542581550362624,137407124,Twitter Web Client,2014-12-04 16:26:08,11,6,My Washington DC office has moved! We are now in room 2202 in the Rayburn Building. Stop by to enjoy a cold Coke-a-Cola &amp; Georgia peanuts!,,,,,
repwestmoreland,540520826014294016,137407124,Twitter Web Client,2014-12-04 14:59:41,1,0,Good morning! Here is today's legislative schedule --&gt; http://t.co/5ZpdNACHTH @HouseFloor,,,,,
repwestmoreland,539891884207128576,137407124,Twitter Web Client,2014-12-02 21:20:30,1,1,"@JoelCRosenberg Great to see you, too!",JoelCRosenberg,539881569650212866,,,
repwestmoreland,539888567972278273,137407124,Twitter Web Client,2014-12-02 21:07:19,1,0,"ICYMI @peachpundit: ""New Ozone Standards Could Put Much of Georgia Out of Compliance — Again"" http://t.co/8KRpGAmQz4",,,,,
repwestmoreland,539534709513273347,137407124,Twitter Web Client,2014-12-01 21:41:13,1,1,"Obama's new proposed EPA standards threaten manufacturers, jobs &amp; power plants. --&gt; http://t.co/rvoJyUA08Z",,,,,
repwestmoreland,537984234586009600,137407124,TweetDeck,2014-11-27 15:00:11,1,4,From the Westmoreland family: We hope you have a blessed and Happy Thanksgiving!,,,,,
repwestmoreland,536949954129174528,137407124,Twitter Web Client,2014-11-24 18:30:19,1,3,"On Saturday, the Academy Board interviewed #GA03's qualified candidates for Service Academy Nominations in PTC. http://t.co/1EKRfwxWiO",,,,,
repwestmoreland,535837656958369792,137407124,Twitter Web Client,2014-11-21 16:50:27,1,0,"The pres himself said 22 times he cant act alone on immigration, &amp; by doing it now he squashes chances for reform --&gt; http://t.co/HSNh8rD2VD",,,,,
repwestmoreland,535519484879306753,137407124,Twitter Web Client,2014-11-20 19:46:09,3,0,"Today, the House voted to promote American manufacturing &amp; jobs, an important industry in #GA03--&gt; http://t.co/h0dSvgc89L",,,,,
repwestmoreland,535151309096513537,137407124,Twitter Web Client,2014-11-19 19:23:09,4,2,#GA03 is home to many FAA employees so it's always good to talk with the Air Line Pilots Association in DC. http://t.co/iGsusxuqyA,,,,,
repwestmoreland,534842572649549826,137407124,Twitter for iPhone,2014-11-18 22:56:20,5,5,Congrats to my friend &amp; fellow Georgian @RepTomPrice on being named Chairman of the House Budget Committee in the 114th Congress!,,,,,
repwestmoreland,534826591722143744,137407124,Twitter Web Client,2014-11-18 21:52:50,0,1,Great for #GA03: @Kia Georgia continues support of SAE Foundation &amp; Troup Schools w/ third $300K contribution http://t.co/aWPsQ0DMeX #STEM,,,,,
repwestmoreland,534815727480766465,137407124,Twitter Web Client,2014-11-18 21:09:40,1,1,"Congrats to @Rep_DevinNunes, the @HouseIntelComm Chairman for the 114th Congress.",,,,,
repwestmoreland,534723612050468864,137407124,Twitter Web Client,2014-11-18 15:03:38,3,1,"Once again, the president signals he will go around congress instead of work with us on major reforms. --&gt; http://t.co/9YBAHIjISJ",,,,,
repwestmoreland,534358158903640064,137407124,Twitter Web Client,2014-11-17 14:51:27,3,0,The House is in session today. Here's the legislative schedule: http://t.co/lCGZs2tIZR,,,,,
repwestmoreland,533317862015135744,137407124,Twitter Web Client,2014-11-14 17:57:41,6,6,The House just voted to approve the #KeystoneXLPipeline with my support --&gt; http://t.co/q3SkxwlfcP,,,,,
repwestmoreland,533258099423850497,137407124,TweetDeck,2014-11-14 14:00:13,1,3,#TGIF. The House is in session today. Here's the legislative schedule --&gt; http://t.co/7AxFWA2xIn Follow @HouseFloor for floor updates.,,,,,
repwestmoreland,532895685088002049,137407124,TweetDeck,2014-11-13 14:00:06,2,1,Good morning! The House is back in session. Click here for today's legislative schedule --&gt; http://t.co/lj7D0L1hZw,,,,,
repwestmoreland,532564667164807170,137407124,Twitter Web Client,2014-11-12 16:04:45,0,0,Thanks to Campanelli Farm for inviting me to their 2nd Annual Veteran's Day BBQ in Newnan. #VeteransDay http://t.co/I8XwEDVbqS,,,,,
repwestmoreland,532547103852343296,137407124,Twitter Web Client,2014-11-12 14:54:58,1,0,"On Saturday, I had the honor of thanking Carroll County Veterans. Check out pictures from the event here --&gt; http://t.co/KMNK26Sgjm",,,,,
repwestmoreland,532246484146614272,137407124,TweetDeck,2014-11-11 19:00:25,1,1,Stopped by @HeroBox in Senoia to learn about the custom care packages they send our troops serving overseas. http://t.co/mMAR6wopel,,,,,
repwestmoreland,532236488583675905,137407124,TweetDeck,2014-11-11 18:20:42,2,0,"It was an honor to thank the veterans of Tyrone, GA for their service &amp; sacrifice today at the #VeteransDay Program. http://t.co/niz3VXrkQZ",,,,,
repwestmoreland,532201187286609921,137407124,TweetDeck,2014-11-11 16:00:25,0,0,This week's Capitol Corner: A tribute to our #Veterans. Read more here --&gt; http://t.co/60SRuiMhHz #VeteransDay,,,,,
repwestmoreland,532170944286978048,137407124,TweetDeck,2014-11-11 14:00:15,2,2,I hope you join me in honoring the brave men &amp; women who served our nation &amp; defended our freedom. #VeteransDay http://t.co/j4eXSa1mp9,,,,,
repwestmoreland,531252774252838912,137407124,Twitter for iPhone,2014-11-09 01:11:46,1,0,"RT @warriors_mom: @GOPLeader @RepWestmoreland one of my sons, on my Twitter picture already!",,,530878358155177984,75184478,warriors_mom
repwestmoreland,530800576389709824,137407124,Twitter Web Client,2014-11-07 19:14:53,39,0,"RT @GOPLeader: Now through #VeteransDay, show your gratitude by tweeting photos of the special vets in your life using #AmericasVets http:/…",,,530760199444103168,19739126,GOPLeader
repwestmoreland,530071417489211392,137407124,Twitter Web Client,2014-11-05 18:57:28,5,2,My office is currently accepting applications for our spring internship program in the DC &amp; GA offices. Apply here --&gt;http://t.co/K7KHPGXvRi,,,,,
repwestmoreland,530051295554842624,137407124,Twitter Web Client,2014-11-05 17:37:31,86,0,RT @HouseBenghazi: This is the official Twitter account for the House Select Committee on the Events surrounding the 2012 Terrorist attack …,,,529675934744735745,2786564756,HouseBenghazi
repwestmoreland,529706800854335488,137407124,Twitter Web Client,2014-11-04 18:48:37,1,2,"Always a pleasure to meet with Realtors of #GA03, especially at the delicious Sprayberry's in Newnan! http://t.co/xq2BY9Hkzn",,,,,
repwestmoreland,529655459670933504,137407124,Twitter Web Client,2014-11-04 15:24:36,1,1,"ICYMI: @thehill ""House Republican urges administration to stop Gitmo transfers"" -&gt; http://t.co/a1okgX01p1 #CapitolCorner",,,,,
repwestmoreland,529341805721292800,137407124,Twitter Web Client,2014-11-03 18:38:15,3,0,Releasing prisoners from Gitmo gives them a second chance. Obama must stop the transfers to protect America --&gt; http://t.co/wQ0RkzM1rt,,,,,
repwestmoreland,528175915705311232,137407124,Twitter Web Client,2014-10-31 13:25:26,2,0,RT @FinancialCmte What’s millions of pages &amp; kills jobs? WATCH: http://t.co/VU4rp9diNv #Halloween,,,,,
repwestmoreland,527513180680249345,137407124,Twitter Web Client,2014-10-29 17:31:57,4,0,"RT @TroupCoGov: @RepWestmoreland in LaGrange to honor the Chamber's 2014 Mfrs of the Yr, Powertech &amp; MM. Photo CC of @LaGrangeMayor. http:/…",,,527505792539590656,382236346,TroupCoGov
repwestmoreland,527477773242478592,137407124,Twitter Web Client,2014-10-29 15:11:15,27,0,"RT @BretBaier: Defense Sec Hagel orders mandatory 21-day ""quarantine"" for all services coming from Ebola hit areas",,,527476448630960128,18646108,BretBaier
repwestmoreland,527466751358144512,137407124,Twitter Web Client,2014-10-29 14:27:28,2,0,Great turnout at this mornings town hall meeting at @UGAGriffin! Thanks to everyone for coming by &amp; asking questions. http://t.co/IF3CaT92Fc,,,,,
repwestmoreland,527173088509562881,137407124,TweetDeck,2014-10-28 19:00:33,0,0,Thank you to SoundChoice Pregnancy Clinic in Columbus for inviting me to tour your facility this morning. http://t.co/79hTGBthuz,,,,,
repwestmoreland,527144515745112065,137407124,Twitter Web Client,2014-10-28 17:07:01,1,1,Congrats to Mountville Manufacturing of Troup County on receiving the 2014 Georgia Manufacturers of the Year Award! http://t.co/5TUi5hXFim,,,,,
repwestmoreland,527144190749466624,137407124,Twitter Web Client,2014-10-28 17:05:43,0,2,It was my pleasure to present PowerTech America with the Georgia Manufacturers of the Year 2014 Award in LaGrange! http://t.co/wV12goysJi,,,,,
repwestmoreland,524953983765733376,137407124,Twitter Web Client,2014-10-22 16:02:37,0,0,On Sunday I joined Straightforward w/ Gloria Strode to discuss the constituent services my office provides. --&gt; http://t.co/4BRRLEvrLs #GA03,,,,,
repwestmoreland,524941263737720832,137407124,Twitter Web Client,2014-10-22 15:12:04,0,0,Want to stay up to date on what I'm up to in DC &amp; #GA03? Sign up for my weekly e-newsletter here --&gt; http://t.co/RiJP4BSORm,,,,,
repwestmoreland,524940468896153601,137407124,Twitter Web Client,2014-10-22 15:08:55,0,0,Good news for #GA03!: @universityofga breaks ground on Food Technology Center in Griffin --&gt; http://t.co/t4Tcep9Lx4,,,,,
repwestmoreland,524912178785042434,137407124,Twitter for Websites,2014-10-22 13:16:30,1,0,"ICYMI: @TimesHerald ""http://t.co/3zTWL3SD8K: CDC has not done a good job http://t.co/DHPrPCDnKt""",,,,,
repwestmoreland,524214990178648065,137407124,Twitter Web Client,2014-10-20 15:06:07,2,0,"Sec Hagel, climate change is not a national security threat: ISIL, Ebola, debt, &amp; Russia/Ukraine are. --&gt; http://t.co/NrqtokIpCL #priorities",,,,,
repwestmoreland,523843546747396096,137407124,TweetDeck,2014-10-19 14:30:08,2,1,HAPPENING NOW: I'm on 'Straight Forward with Gloria Strode' on the CW (Channel 2) in Columbus to talk about the VA. http://t.co/DgQLiP8Gwf,,,,,
repwestmoreland,523836003019005952,137407124,TweetDeck,2014-10-19 14:00:10,2,0,TUNE IN: At 10:30am I'll be on 'Straight Forward with Gloria Strode' on the CW (Channel 2) in Columbus to discuss the VA. #GA03,,,,,
repwestmoreland,523500059522891776,137407124,TweetDeck,2014-10-18 15:45:15,1,0,TUNE IN: Tomorrow at 10:30am I'll be on 'Straight Forward with Gloria Strode' on the CW in Columbus --&gt; http://t.co/KCly1Put0s,,,,,
repwestmoreland,523201641198419969,137407124,Twitter Web Client,2014-10-17 19:59:26,0,0,"ICYMI: @UGAToday ""Georgia leads the nation in blueberry production"" --&gt; http://t.co/QWsP7LPsa7 #GAagriculture",,,,,
