user_screen_name,id,user_id,source,created_at,retweet_count,favorite_count,text,in_reply_to_screen_name,in_reply_to_status_id,retweeted_status_id,retweeted_status_user_id,retweeted_status_user_screen_name
repwestmoreland,259318956697985024,137407124,Twitter Web Client,2012-10-19 15:43:51,0,0,My thoughts on the September #jobs report: http://t.co/ap8LceZa,,,,,
repwestmoreland,259317148906827776,137407124,Twitter Web Client,2012-10-19 15:36:40,0,1,I have joined the Congressional #Lupus Caucus to help educate and raise awareness for this debilitating desease. http://t.co/DJNreVC0,,,,,
repwestmoreland,258954340348334080,137407124,Twitter Web Client,2012-10-18 15:35:00,1,1,President Obama's Tax Claims vs Reality: http://t.co/I1OfdPTr,,,,,
repwestmoreland,258332212896870400,137407124,Twitter for BlackBerry®,2012-10-16 22:22:53,0,0,Just finished up a great town hall in Fayetteville. Looking forward to THs in Barnesville and Carrollton in 2 weeks. http://t.co/Hfy9pOUA,,,,,
repwestmoreland,258283038172119040,137407124,Twitter Web Client,2012-10-16 19:07:29,3,0,TONIGHT I am hosting a town hall in Fayetteville at Fayette County Commissioners' Office from 5-6pm! http://t.co/Hfy9pOUA,,,,,
repwestmoreland,257964758744051712,137407124,Twitter Web Client,2012-10-15 22:02:45,1,0,Plant Vogtle reached 10 million work hours on the 2 new nuclear reactors. http://t.co/AcBn21ln,,,,,
repwestmoreland,257897450596098048,137407124,Twitter Web Client,2012-10-15 17:35:18,1,0,Reminder: Tomorrow I am hosting a town hall in Fayetteville at the Fayette County Commissioner's Office from 5-6pm! http://t.co/EJmBydMT,,,,,
repwestmoreland,257895680549482496,137407124,Twitter Web Client,2012-10-15 17:28:16,0,0,"Earlier this month, the President recommended defense contractors hold off on issuing sequester lay off warnings. http://t.co/96sD4unf",,,,,
repwestmoreland,256616008712876032,137407124,Twitter for BlackBerry®,2012-10-12 04:43:18,0,1,@tish919 Please let Brad know he is in mine and Joan's thoughts. We are so proud to have brave men and women like him serving our country!,tish919,256580963763642369,,,
repwestmoreland,256445291736231936,137407124,Twitter Web Client,2012-10-11 17:24:56,0,0,@HouseIntelComm's investigative report on Chinese Telecommunication companies #Huawei &amp; #ZTE http://t.co/h4SQz4Io,HouseIntelComm,,,,
repwestmoreland,256390637149097984,137407124,Twitter Web Client,2012-10-11 13:47:46,0,1,GAs privately owned #SouthernCompany and #TurnerRenewableEnergy invest in 3rd solar facility &amp; green energy development http://t.co/9h0u0c89,,,,,
repwestmoreland,256386702371864576,137407124,Twitter Web Client,2012-10-11 13:32:07,0,0,"Hope to see you at my town hall meeting next Tuesday, Oct 16th at the Fayette County Commissioners' Office, 5pm-6pm. http://t.co/baKOOCRv",,,,,
repwestmoreland,256139183821832192,137407124,Twitter Web Client,2012-10-10 21:08:34,0,0,@Kia_Motors Manufacturing GA now accepting applications for Advanced Manufacturing Systems and Technology Positions http://t.co/AtSLMVg4,Kia_Motors,,,,
repwestmoreland,256019470290653184,137407124,Twitter Web Client,2012-10-10 13:12:52,0,0,This week is #NationalFirePreventionWeek http://t.co/0kqgEdx6,,,,,
repwestmoreland,253567355303641088,137407124,Twitter Web Client,2012-10-03 18:49:03,1,0,"In September, the House passed the HR 3783, the Countering Iran in the Western Hemisphere Act with bipartisan support. http://t.co/yQAf43BR",,,,,
repwestmoreland,253559969868292096,137407124,Twitter Web Client,2012-10-03 18:19:42,1,0,"On Sept 19, the House passed the Buffett Rule Act giving wealthy Americans the choice to donate to the national deficit http://t.co/zVKyy09S",,,,,
repwestmoreland,252864722892906496,137407124,Twitter Web Client,2012-10-01 20:17:02,0,0,"Late last month, the Senate passed Westmoreland legislation to save manufacturing jobs in Georgia. http://t.co/umLhb2GR",,,,,
repwestmoreland,252859450212352000,137407124,Twitter Web Client,2012-10-01 19:56:05,0,0,"Today marks the end of FY12 &amp; the beginning of the ""fiscal cliff"" countdown to higher taxes &amp; devastating defense cuts. http://t.co/aEPHCffS",,,,,
repwestmoreland,252856822866776064,137407124,Twitter Web Client,2012-10-01 19:45:39,1,0,I am honored to receive a 100% approval rate on the Business Coalition for Fair Competition's Congressional scorecard http://t.co/FuEMgzWw,,,,,
repwestmoreland,250663020064280577,137407124,Twitter Web Client,2012-09-25 18:28:15,1,0,CBO Report: #ObamaCare to Affect 6 Million More Families http://t.co/jNW5wDBe,,,,,
repwestmoreland,250313417313878016,137407124,Twitter Web Client,2012-09-24 19:19:03,0,0,"ICYMI: Yesterday, House Intel Chairman @RepMikeRogers spoke on ""State of the Union"" calling on Obama to lead on Libya. http://t.co/gFnALteE",,,,,
repwestmoreland,250258254796562433,137407124,Twitter Web Client,2012-09-24 15:39:52,1,0,Stop by one of my 4 Town Hall Meetings this October in the 3rd district. http://t.co/cA5a8PLi @fayettegagop @MuscogeeGOP @GaRepublicans,,,,,
repwestmoreland,249183727597531136,137407124,Twitter Web Client,2012-09-21 16:30:04,2,0,Thankful for those who have made it home and praying for those who haven't as we observe National POW/MIA Recognition Day.,,,,,
repwestmoreland,249180343666606080,137407124,Twitter Web Client,2012-09-21 16:16:38,0,1,ICYMI: My interview with Fox 5 Atlanta discussing the President's weak response to the violence in the Middle East. http://t.co/B3wxJNlb,,,,,
repwestmoreland,249129035811135488,137407124,Twitter Web Client,2012-09-21 12:52:45,0,0,Good morning! Today the House is in session and voting. Here's the full schedule: http://t.co/JFHNNmdS @HouseFloor,,,,,
repwestmoreland,248899711405289472,137407124,Twitter Web Client,2012-09-20 21:41:30,0,0,"With my full support, the House passed #HJRES118 demanding President Obama to restore work requirements in welfare. http://t.co/kyoOoX0s",,,,,
repwestmoreland,248893818550763520,137407124,Twitter Web Client,2012-09-20 21:18:05,19,0,RT @HASCRepublicans: Sequestration Begins: Northrop Grumman says it wil cut its payroll by nearly 600 employees http://t.co/lJ22Qe0r,,,248847982798176256,20192403,HASCRepublicans
repwestmoreland,248889365323993088,137407124,Twitter Web Client,2012-09-20 21:00:24,0,1,Had a great meeting with representatives from #Kia and President Chung this afternoon. http://t.co/lyOZpn7t,,,,,
repwestmoreland,248879186964537344,137407124,Twitter Web Client,2012-09-20 20:19:56,5,1,Congratulations to Laurie Barron and Kevin Dowling on being Metlife/NASSP's State Principals of the Year from Georgia! http://t.co/rg842vrl,,,,,
repwestmoreland,248824829476741121,137407124,Twitter Web Client,2012-09-20 16:43:56,4,0,Tomorrow I am voting to give the power back to the miners and out of the hands of Obama and the EPA #StoptheWaronCoal http://t.co/gkKtfIO8,,,,,
repwestmoreland,248777560459186177,137407124,Twitter Web Client,2012-09-20 13:36:07,5,0,RT @RepTimScott: OIG report on #FastAndFurious released yesterday. See the key findings here - http://t.co/BLLZrZ5R,,,248777276962000897,217543151,RepTimScott
repwestmoreland,248774598114562048,137407124,Twitter Web Client,2012-09-20 13:24:20,12,0,RT @TGowdySC: Team @GOPoversight will start our hearing with the Inspector General at 9:30 am to talk about #FastandFurious. http://t.co ...,,,248772988932067328,237348797,TGowdySC
repwestmoreland,248772691761451008,137407124,Twitter Web Client,2012-09-20 13:16:46,0,0,Good morning! Today the House is in session. Here's the schedule: http://t.co/JFHNNmdS @HouseFloor,,,,,
repwestmoreland,248542796938616833,137407124,Twitter Web Client,2012-09-19 22:03:15,0,0,My thoughts on the Inspector General's report on #FastandFurious http://t.co/zyEpQKQX,,,,,
repwestmoreland,248448218357190660,137407124,Twitter Web Client,2012-09-19 15:47:25,1,0,I am proud to announce Fayette County's 2012 grads rank among the top in both the state and nation in SAT &amp; ACT scores. http://t.co/vsP5tG7g,,,,,
repwestmoreland,248441521643343873,137407124,Twitter Web Client,2012-09-19 15:20:49,0,0,Happy Birthday @RepTimScott!,,,,,
repwestmoreland,248401478811799553,137407124,Twitter Web Client,2012-09-19 12:41:42,0,0,Good morning! Today the House is in session. Here is today's schedule: http://t.co/JFHNNmdS @HouseFloor,,,,,
repwestmoreland,248157771730669568,137407124,Twitter Web Client,2012-09-18 20:33:17,2,0,Happy 65th birthday to the @USAirForce! Thank you to all the brave men and women who keep our skies safe.,,,,,
repwestmoreland,248152136863600640,137407124,Twitter Web Client,2012-09-18 20:10:54,0,0,Tomorrow the House will be back in session. Here's what we'll be voting on: http://t.co/4VmgwKIW @HouseFloor,,,,,
repwestmoreland,247749535902879744,137407124,Twitter Web Client,2012-09-17 17:31:06,4,0,Happy #ConstitutionDay! Today marks the 225th anniversary of the signing of our nation's great Constitution. http://t.co/JhlkX0Dx,,,,,
repwestmoreland,247728125637718016,137407124,Twitter Web Client,2012-09-17 16:06:02,4,0,"Last week, I was honored to receive the Freedom Fighter Award from @FreedomWorks http://t.co/sgTvAXPU",,,,,
repwestmoreland,246642859707604992,137407124,Twitter Web Client,2012-09-14 16:13:34,2,0,RT @Max_Pappas: Presenting @FreedomWorks 2011Freedom Fighter Award to @repwestmoreland for defending economic freedom! #tcot http://t.co ...,,,246617110384619522,540257303,Max_Pappas
repwestmoreland,246600584319344640,137407124,Twitter Web Client,2012-09-14 13:25:35,3,0,Today the House votes on #NoMoreSolyndrasAct to prevent taxpayers dollars from being spent on Obama's risky investments http://t.co/bziyVGr8,,,,,
repwestmoreland,246591936201367552,137407124,Twitter Web Client,2012-09-14 12:51:13,0,0,Good morning! Today the House is in session. Full schedule: http://t.co/p52yDZpl @HouseFloor,,,,,
repwestmoreland,246345541900984320,137407124,Twitter Web Client,2012-09-13 20:32:08,0,0,My official statement on the recent violent uprisings in the Middle East. http://t.co/LCYZRyTW,,,,,
repwestmoreland,246336151668023296,137407124,Twitter Web Client,2012-09-13 19:54:49,0,0,"Even though the #Olympics are over, we are always proud of and inspired by your achievements. #ThanksTeamUSA http://t.co/yIKJerZn",,,,,
repwestmoreland,246236017177288704,137407124,Twitter Web Client,2012-09-13 13:16:55,0,0,TUNE IN: Watch the Intel Committee @HouseIntelComm hearing on Chinese #telecom companies Huawei and ZTE LIVE at 10:00am http://t.co/3zIp56cg,,,,,
repwestmoreland,246229962078699520,137407124,Twitter Web Client,2012-09-13 12:52:52,1,0,Good morning! Today the House is in session. Full schedule: http://t.co/p52yDZpl @HouseFloor,,,,,
repwestmoreland,245990337368182784,137407124,Twitter Web Client,2012-09-12 21:00:41,0,0,"House Intel Committee holds a hearing tomorrow on security threats posed by 2 Chinese telecom companies, watch it live http://t.co/h22sb5jB",,,,,
repwestmoreland,245895027170095105,137407124,Twitter Web Client,2012-09-12 14:41:57,0,0,Joan and I were saddened to hear of the deaths of US officials in Libya. We send our prayers to the families of those who lost their lives.,,,,,
repwestmoreland,245520626926882817,137407124,Twitter Web Client,2012-09-11 13:54:13,1,0,Joan and I send our prayers to those who lost someone on 9/11. May God watch over our brave soliders who protect us at home and overseas.,,,,,
repwestmoreland,233968653731758081,137407124,Twitter Web Client,2012-08-10 16:50:48,1,0,Great piece on the #rail event I held yesterday with @CSX and STX at the @Kia plant in West Point. http://t.co/72Z0vRYi #jobs,,,,,
repwestmoreland,233609892743753728,137407124,Twitter for BlackBerry®,2012-08-09 17:05:13,1,0,Had a great briefing on @Kia_Motors use of railroads at West Point plant &amp; was so honored to be joined by Kia Pres Ahn. http://t.co/xeeXtx0G,,,,,
repwestmoreland,233582434728435714,137407124,Twitter for BlackBerry®,2012-08-09 15:16:08,1,0,Getting ready for a great event at the @Kia_Motors plant in West Point with CSX and STX rail companies. http://t.co/k74Uan9X,,,,,
repwestmoreland,228574450596057088,137407124,Twitter Web Client,2012-07-26 19:36:10,1,0,Want to wish my good friend @MarthaRoby a happy birthday!,,,,,
repwestmoreland,228550393066582018,137407124,Twitter Web Client,2012-07-26 18:00:34,2,0,Rep. Mike Kelly gave a great speech today on the red tape bill we voted on earlier. http://t.co/JVTubXMf #RedTapeWeek,,,,,
repwestmoreland,228490173506256896,137407124,Twitter Web Client,2012-07-26 14:01:17,0,0,It's been a pleasure watching @MonicaWSB anchor the news. http://t.co/B5zZiwm2,,,,,
repwestmoreland,228131929743060993,137407124,Twitter Web Client,2012-07-25 14:17:45,3,0,"RT @FinancialCmte: If #POTUS &amp; #FedChair acknowledge entitlement spending is unsustainable, why is it not cited in FSOC report? - @R ...",,,228131536690618368,42924141,FinancialCmte
repwestmoreland,228125630380785664,137407124,Twitter Web Client,2012-07-25 13:52:43,2,0,RT @FinancialCmte: Watch Live NOW: http://t.co/hhk17hRQ #Treasury Secretary #Geithner testifies before @FinancialCmte #tcot #4jobs,,,228120850803593216,42924141,FinancialCmte
repwestmoreland,225631848393490434,137407124,Twitter Web Client,2012-07-18 16:43:19,3,1,"#GOP will continue to tell the #Fed, #Bernanke, and Obama #NoMoreBailouts",,,,,
repwestmoreland,225631355348856832,137407124,Twitter Web Client,2012-07-18 16:41:21,0,0,"Dems wrapping up the @FinancialCmte hearing right where they were in 2008-2009, supporting bailouts and more government spending.",,,,,
repwestmoreland,225614989296271362,137407124,Twitter Web Client,2012-07-18 15:36:19,4,0,#Bernanke doesn't believe regulatory changes of Dodd-Frank are material to market uncertainty. Thats not what banks and lenders are saying.,,,,,
repwestmoreland,225611839537553408,137407124,Twitter Web Client,2012-07-18 15:23:48,5,0,RT @FinancialCmte: #Obamacare is a large factor causing uncertainty for small manufacturers: @DonManzullo to #FedChair #Bernanke,,,225611055882174464,42924141,FinancialCmte
repwestmoreland,225611786223763459,137407124,Twitter Web Client,2012-07-18 15:23:36,1,0,#Bernanke said that the impact of the affordable care act cannot be measured; unclear if people will lose jobs because of #Obamacare.,,,,,
repwestmoreland,225607760635641856,137407124,Twitter Web Client,2012-07-18 15:07:36,0,0,"@RepHensarling questions the economy's record slow growth out of the recession, #Bernanke dodging the answers",RepHensarling,,,,
repwestmoreland,225605519291850753,137407124,Twitter Web Client,2012-07-18 14:58:42,3,0,RT @FinancialCmte: .@RepHensarling asks #FedChair #Bernanke: Why shouldn't American people come to conclusion that we've had profound fa ...,,,225605381253111808,42924141,FinancialCmte
repwestmoreland,225605421354856448,137407124,Twitter Web Client,2012-07-18 14:58:18,40,5,"I agree with @RepRonPaul's statement, the #FedReserve should not be able to operate in the shadows #AuditTheFed",,,,,
repwestmoreland,225601283086761985,137407124,Twitter Web Client,2012-07-18 14:41:52,28,4,#Bernanke says @RepRonPaul bill will politicize the #FedReserve. Sorry but you politicized the Fed in 08 when you bailed out big banks.,,,,,
repwestmoreland,225600461691043841,137407124,Twitter Web Client,2012-07-18 14:38:36,6,2,"Looks like the House will vote next week on @RepRonPaul 's bill to #AuditTheFed, which I am a cosponsor of.",,,,,
repwestmoreland,225599092045262848,137407124,Twitter Web Client,2012-07-18 14:33:09,5,0,I would like to recognize @RepRonPaul on his last hearing as a Member of Congress with #FedReserve Chairman #Bernanke.,,,,,
repwestmoreland,225593005585858560,137407124,Twitter Web Client,2012-07-18 14:08:58,2,0,"Today the @FinancialCmte holds a hearing with #Bernanke on the state of the #economy, watch it live: http://t.co/veMY4dVS",,,,,
repwestmoreland,223148995135012864,137407124,Twitter Web Client,2012-07-11 20:17:21,1,0,"House passes bipartisan bill to repeal #ObamaCare, one of the largest #taxes in American history. #FullRepeal http://t.co/Serce5QJ",,,,,
repwestmoreland,222429249796190210,137407124,Twitter Web Client,2012-07-09 20:37:20,0,0,Pres Obama announced today he wanted to raise taxes on #job creators to pay for more of his bloated govt spending. http://t.co/PRshMm48,,,,,
repwestmoreland,222369031724871681,137407124,Twitter Web Client,2012-07-09 16:38:03,1,0,The House will be in session today through Thursday. We will once again vote on a bill for #FullRepeal of #ObamaCare this week.,,,,,
repwestmoreland,220546547992104960,137407124,Twitter Web Client,2012-07-04 15:56:09,1,0,Wishing you and your family a very happy July 4th! May God continue to bless our great nation! #IndependenceDay,,,,,
repwestmoreland,219838220416987138,137407124,Twitter Web Client,2012-07-02 17:01:30,1,0,"About to start my tour of the Sewon Plant, one of the supplies for the @Kia plant in West Point. Looking forward to it!",,,,,
repwestmoreland,219837917076537345,137407124,Twitter Web Client,2012-07-02 17:00:19,0,0,Just had a great lunch with some local community leaders in West Point at Charlie Joseph's. Thanks for the invite! http://t.co/yXFnBXCQ,,,,,
repwestmoreland,218720117473812482,137407124,Twitter Web Client,2012-06-29 14:58:34,0,0,@juliewolfe Lots of buzz but mainly lots of resolve to repeal the largest #tax on American families &amp; small biz in our history. #ObamaCare,JulieWolfe,218718537932488706,,,
repwestmoreland,218718171874590720,137407124,Twitter Web Client,2012-06-29 14:50:50,1,0,Here's an interesting article from the @ajc on how the #ObamaCare decision will impact #Georgia: http://t.co/vSOU4w2t. #FullRepeal,,,,,
repwestmoreland,218699609994829825,137407124,Twitter Web Client,2012-06-29 13:37:04,1,0,The House is in session and voting today on the Transp &amp; HUD approps bill and the highway authorization. Full schedule: http://t.co/p52yDZpl,,,,,
repwestmoreland,218459906121023489,137407124,Twitter Web Client,2012-06-28 21:44:35,6,2,Here's my statement on why I voted to hold AG #Holder in contempt for failing to turnover #FastAndFurious documents: http://t.co/AQ0tC3fN,,,,,
repwestmoreland,218452694669594626,137407124,Twitter Web Client,2012-06-28 21:15:55,1,0,Here's a compilation of reactions from #GA Repubs on today's #ObamaCare decision. http://t.co/08vUzalc #FullRepeal @GaRepublicans,,,,,
repwestmoreland,218448963160915968,137407124,Twitter Web Client,2012-06-28 21:01:06,1,1,House just voted to hold AG #Holder in #contempt of Congress for his refusal to turn over subpoenaed documents related to #FastAndFurious.,,,,,
repwestmoreland,218425409765769217,137407124,Twitter Web Client,2012-06-28 19:27:30,3,1,House to hold #contempt vote on #AGHolder over his refusal to comply with subpoena to produce documents about #FastAndFurious around 5pm.,,,,,
repwestmoreland,218410361928421376,137407124,Twitter Web Client,2012-06-28 18:27:42,0,0,"Due to votes, my call with @allnews1067 got postponed to tomorrow morning at 7:50am. TUNE IN then to hear me talk about #ObamaCare decision.",,,,,
repwestmoreland,218396690510659584,137407124,Twitter Web Client,2012-06-28 17:33:23,18,0,RT @BuzzFeedBen: So interesting: Was Scalia's dissent originally a majority opinion? http://t.co/S3M1M6JT,,,218396081745174528,9532402,BuzzFeedBen
repwestmoreland,218394861043331072,137407124,Twitter Web Client,2012-06-28 17:26:07,0,0,TUNE IN: I will be on @allnews1067 at about 1:50pm today to talk about the #ObamaCare decision today. http://t.co/t20IGeG9 #FullRepeal,,,,,
repwestmoreland,218393168251596800,137407124,Twitter Web Client,2012-06-28 17:19:23,28,1,Just heard from a constituent in Whitesburg GA who told me she may have to fire 80 emps &amp; close shop bc of #ObamaCare #mandates. #FullRepeal,,,,,
repwestmoreland,218387325569347585,137407124,Twitter for BlackBerry®,2012-06-28 16:56:10,1,0,Talking with @MacFarlaneNews about today's #ObamaCare ruling for @wsbtv. #FullRepeal http://t.co/oH02h2WC,,,,,
repwestmoreland,218382797964976128,137407124,Twitter Web Client,2012-06-28 16:38:11,1,0,"""This mandate is a tax on the American people, plain and simple."" My statement on #ObamaCare decision: http://t.co/0T6XnTJ8 #FullRepeal",,,,,
repwestmoreland,218374417309380609,137407124,Twitter for BlackBerry®,2012-06-28 16:04:52,1,0,"""What the Supreme Court did not do on its last day in session, I will do in my first day in office."" @MittRomney #FullRepeal",,,,,
repwestmoreland,218367115445542912,137407124,Twitter Web Client,2012-06-28 15:35:52,764,0,RT @AllenWest: A sad day for America as Congress has now been granted infinite taxation power... http://t.co/Mt8duqaO,,,218365914029096961,237403203,AllenWest
repwestmoreland,218363355692417026,137407124,Twitter Web Client,2012-06-28 15:20:55,438,0,RT @EricCantor: The House will vote to fully repeal Obamacare on July 11.,,,218362767592259585,5561412,EricCantor
repwestmoreland,218358743845453824,137407124,Twitter Web Client,2012-06-28 15:02:36,3,0,"Great sentiment by @RepDavid: #SCOTUS ""just woke up a sleeping giant...election just rolled back to 2010 because it was driven by Obamacare""",,,,,
repwestmoreland,218358261433380864,137407124,Twitter Web Client,2012-06-28 15:00:41,2,0,House will vote again for #FullRepeal on #ObamaCare the week of July 9th after the decision to uphold the law today by #SCOTUS.,,,,,
repwestmoreland,218357963130277889,137407124,Twitter Web Client,2012-06-28 14:59:29,0,0,Here is the full opinion on the #ObamaCare ruling by the #SCOTUS: http://t.co/7wvhyfCt #RepealItNow #FullRepeal,,,,,
repwestmoreland,218350644279525378,137407124,Twitter Web Client,2012-06-28 14:30:25,4,0,I am shocked and upset the #SCOTUS has upheld this unconstitutional law. #ObamaCare,,,,,
repwestmoreland,218338715028819969,137407124,Twitter Web Client,2012-06-28 13:43:00,1,0,RT @ajconwashington: The scene outside SCOTUS http://t.co/EQPs540O,,,218338178443124737,89460898,ajconwashington
repwestmoreland,218331676785377280,137407124,Twitter Web Client,2012-06-28 13:15:02,0,0,We are waiting for the #SCOTUS decision on #ObamaCare that's expected at10am. Watch LIVE reporting from the Court: http://t.co/r7ONnVpH,,,,,
repwestmoreland,218145948281475073,137407124,Twitter for BlackBerry®,2012-06-28 00:57:01,5,0,RT @ChadPergram: Expect the House to begin the #contempt process in the House Thursday around 12:30 pm et with final votes completed by ...,,,218131888706035713,16187637,ChadPergram
repwestmoreland,218076509863297026,137407124,Twitter Web Client,2012-06-27 20:21:06,1,0,"RT @FinancialCmte: Our cmte has heard from 346 witnesses at hearings on impact #DoddFrank is having on economy, jobs, financial system. ...",,,218073795561402368,42924141,FinancialCmte
repwestmoreland,218024806589792257,137407124,Twitter for BlackBerry®,2012-06-27 16:55:39,598,0,RT @RepRonPaul: So pleased that Audit the Fed legislation passed out of committee this morning! Now onto the House Floor! #auditthefed,,,218023232891142145,76966145,RepRonPaul
repwestmoreland,218023577801342976,137407124,Twitter for BlackBerry®,2012-06-27 16:50:46,0,1,@Brett_D_Smith It was great to meet you too! Thanks for stopping by and great picture!,brettdsmith_,217423941545897984,,,
repwestmoreland,218017496794546176,137407124,Twitter Web Client,2012-06-27 16:26:36,2,0,RT @RepKevinBrady: ObamaCare by the Numbers from the House Ways &amp; Means Committee http://t.co/dAIfzNcM,,,218003453954375682,19926675,RepKevinBrady
repwestmoreland,218009064628682753,137407124,Twitter Web Client,2012-06-27 15:53:06,3,0,"RT @HerreraBeutler: Today’s PTSD Awareness Day. Serious issue that deserves our attention. Resources available, including: http://t.co/t ...",,,218001207388680193,242926427,HerreraBeutler
repwestmoreland,218008483088433153,137407124,Twitter Web Client,2012-06-27 15:50:47,0,0,Want to wish good luck to my fellow Georgians @AustinScottGA08 and @JackKingston in tmrw's #CongressionalBaseballGame! http://t.co/mIctlVYc,,,,,
repwestmoreland,217969649776721920,137407124,Twitter Web Client,2012-06-27 13:16:28,0,0,Good morning! Today the House is in session and considering the #T-HUD approps bill. Full schedule: http://t.co/p52yDZpl @HouseFloor,,,,,
repwestmoreland,217668722368856066,137407124,Twitter Web Client,2012-06-26 17:20:42,15,0,"RT @RepTimScott: Pres doesnt get his way w/ #SCOTUS, so pulls fed-local partnership allowing local law enforcement 2 help w/immigration ...",,,217668268142505984,217543151,RepTimScott
repwestmoreland,217660794454818816,137407124,Twitter Web Client,2012-06-26 16:49:11,27,0,RT @FoxNews: #GOP senators pressure AG Holder to appoint a special counsel to investigate potential national security leaks http://t.co/ ...,,,217648629282906112,1367531,FoxNews
repwestmoreland,217637551400419328,137407124,Twitter Web Client,2012-06-26 15:16:50,0,0,Happy birthday to Peach Pundit editor Charlie Harper! @IcarusPundit,,,,,
repwestmoreland,217631663264497664,137407124,Twitter Web Client,2012-06-26 14:53:26,2,0,Today the House is in session and voting. Find the full schedule at http://t.co/p52yDZpl and get more info by following @HouseFloor,,,,,
repwestmoreland,217312846596407296,137407124,Twitter Web Client,2012-06-25 17:46:34,2,0,Here's a great piece on the 4 possible outcomes of Thursday's #SCOTUS #ObamaCare announcement from the @WSJ http://t.co/DMxi0L5X,,,,,
repwestmoreland,217302965738934272,137407124,Twitter Web Client,2012-06-25 17:07:18,2,0,"In preparation for Thursday's #SCOTUS #ObamaCare decision, here's a great piece on why we need a full repeal: http://t.co/0eyFerjR",,,,,
repwestmoreland,217279424696025088,137407124,Twitter Web Client,2012-06-25 15:33:46,0,0,BREAKING NEWS: #SCOTUS will announce #ObamaCare decision on Thursday. Stay tuned until then.,,,,,
repwestmoreland,217274270605254659,137407124,Twitter Web Client,2012-06-25 15:13:17,5,0,"RT @GOPWhip: RT @GOPpolicy: The U.S. House of Representatives has voted 30 times to repeal, defund or dismantle parts of #Obamacare. #tcot",,,217269319292301313,19739126,GOPWhip
