user_screen_name,id,user_id,source,created_at,retweet_count,favorite_count,text,in_reply_to_screen_name,in_reply_to_status_id,retweeted_status_id,retweeted_status_user_id,retweeted_status_user_screen_name
repwestmoreland,379757893295562752,137407124,Twitter for iPhone,2013-09-17 00:05:11,5,0,RT @sr2ndblack: Three congressmen talking about #obamacosts. @RepTomGraves @RepTomPrice @RepWestmoreland http://t.co/1SHGefJ8YO,,,379708736618917889,15759091,sr2ndblack
repwestmoreland,379641945422700544,137407124,Twitter Web Client,2013-09-16 16:24:27,10,2,#ObamaCosts 100 Emory health care employees to lose their jobs because of ObamaCare: http://t.co/xyXI2AnJIA,,,,,
repwestmoreland,379641007165284352,137407124,Twitter Web Client,2013-09-16 16:20:44,2,0,"I'm a strong supporter &amp; original cosponsor of the Stability, Security &amp; Fairness Resolution. Read more here: http://t.co/U5LotgLIo3",,,,,
repwestmoreland,379626798884999170,137407124,Twitter Web Client,2013-09-16 15:24:16,2,0,"Today marks the 5 year anniversary of the financial crisis. A reminder that Lehman didn't cause this, bad gov't policy did.",,,,,
repwestmoreland,379622170319540224,137407124,Twitter Web Client,2013-09-16 15:05:53,2,1,"How has ObamaCare negatively affected you, your family, or biz so far? Use #ObamaCosts to share your story and join the conversation.",,,,,
repwestmoreland,379618648706387968,137407124,Twitter Web Client,2013-09-16 14:51:53,5,1,"Just finished talking with @THEHermanCain radio about the Stability, Security, and Fairness Act. Thanks for having me!",,,,,
repwestmoreland,379616000448028672,137407124,Twitter Web Client,2013-09-16 14:41:22,4,3,Joan and I send our thoughts and prayers to those affected by the #NavyYardShooting.,,,,,
repwestmoreland,379615596700110849,137407124,Twitter Web Client,2013-09-16 14:39:45,5,2,#ObamaCosts Trader Joe's part-time employees lose health care coverage under ObamaCare: http://t.co/G5kwCHLtxj,,,,,
repwestmoreland,379614229805793281,137407124,Twitter Web Client,2013-09-16 14:34:19,10,0,"RT @RepThomasMassie: on @RepTomGraves bill 2 fund all existing functions of gvt while defunding #Obamacare-If ACA has hurt you,pls share yo…",,,379601194328395776,975200486,RepThomasMassie
repwestmoreland,379277767885352960,137407124,Twitter Web Client,2013-09-15 16:17:21,44,0,"RT @RepTomGraves: If America hears the truth about Obamacare, we can stop it. How has Obamacare hurt you? Use #ObamaCosts to share your sto…",,,379257298704551936,190328374,RepTomGraves
repwestmoreland,379277323167485952,137407124,Twitter Web Client,2013-09-15 16:15:35,6,1,"From #ObamaCosts stories so far, if Obama really cared about the middle class, he would support a 1 year delay to keep costs from rising.",,,,,
repwestmoreland,379276085696794624,137407124,Twitter Web Client,2013-09-15 16:10:40,3,1,"MT: ""@branmills7m: @RepWestmoreland @FultonGOP I don't know the rise in health care cost hurt every month."" #Obamacosts",,,,,
repwestmoreland,379252790582730752,137407124,Twitter Web Client,2013-09-15 14:38:06,3,1,"If America hears the truth about ObamaCare, we can stop it. How was ObamaCare hurt you? Use the hashtag ""#ObamaCosts"" to share your story.",,,,,
repwestmoreland,378675602469183488,137407124,Twitter for iPhone,2013-09-14 00:24:33,6,2,TUNE IN: I'll be on @11Alive at 11pm tonight to discuss @RepTomGraves plan to keep the govt open &amp; stop #ObamaCare! http://t.co/YBNIT8yQSd,,,,,
repwestmoreland,378666743721639936,137407124,Twitter for iPhone,2013-09-13 23:49:21,33,0,"RT @RepTomGraves: Awesome endorsement of our keep gov't open &amp; #DefundObamacare plan from @seanhannity ""I want to give you as much support …",,,378614557616242688,190328374,RepTomGraves
repwestmoreland,378608848988143616,137407124,Twitter Web Client,2013-09-13 19:59:18,1,0,@RepDeSantis Thanks for the #FF!,RepDeSantis,378608562944999424,,,
repwestmoreland,378608793367502849,137407124,Twitter Web Client,2013-09-13 19:59:05,2,0,RT @RepDeSantis: #FF #FollowFriday @RepBillShuster @MarkSanford @RepJasonSmith @RepWestmoreland @RepTedYoho,,,378608562944999424,1058807868,RepDeSantis
repwestmoreland,378587056290557953,137407124,Twitter Web Client,2013-09-13 18:32:42,3,0,@TeamCavuto Hope you'll also discuss @RepTomGraves plan to keep the gov't open &amp; #DefundObamacare tonight!,TeamCavuto,,,,
repwestmoreland,378586590911528960,137407124,Twitter Web Client,2013-09-13 18:30:51,22,0,"RT @FreedomWorks: “We can fund the government without funding ObamaCare."" @mkibbe on support for @RepTomGraves spending bill. http://t.co/y…",,,378557458488524800,14730894,FreedomWorks
repwestmoreland,378576827553312770,137407124,Twitter Web Client,2013-09-13 17:52:03,1,0,@BretBaier Hope you'll also discuss @RepTomGraves plan to keep the gov't open &amp; #DefundObamacare tonight!,BretBaier,,,,
repwestmoreland,378575291956092928,137407124,Twitter for BlackBerry®,2013-09-13 17:45:57,4,0,"""@Heritage: Congress could defund Obamacare. This is how: http://t.co/iAnx9JxkRr"" Proud to join @RepTomGraves to support this bill!",,,,,
repwestmoreland,378513444493725696,137407124,Twitter Web Client,2013-09-13 13:40:12,2,0,RT @zpolitics: Georgia Reps lead the charge on the CR and #Obamacare http://t.co/XWloykWxcs @marthazoller @RepWestmoreland #gapol #tcot #gop,,,378507744040337408,1231303752,zpolitics
repwestmoreland,378512743726190592,137407124,Twitter Web Client,2013-09-13 13:37:25,24,4,"Proud to be an original cosponsor of @RepTomGraves' bill. It defunds &amp; delays Obamacare till 2015, &amp; funds the govt: http://t.co/DTc3enLJ54",,,,,
repwestmoreland,378503121661472769,137407124,Twitter Web Client,2013-09-13 12:59:11,1,1,Thanks for having me! MT @MarthaZoller: 3h #3bigthings @RepWestmoreland on CR... @wgaunews @timbonole 6-9am http://t.co/TFnC6rLCeu,,,,,
repwestmoreland,378159735536500736,137407124,Twitter Web Client,2013-09-12 14:14:41,1,1,"As Chairman of @HouseIntelComm Oversight &amp; Investigations Subcommittee, I am pleased to announce our Benghazi agenda: http://t.co/oeDZTmb3lm",,,,,
repwestmoreland,377843787906572288,137407124,Twitter Web Client,2013-09-11 17:19:13,1,2,I oppose military action in Syria. Read my stance on this issue in this week's Capitol Corner: http://t.co/lEW2SIvGMp,,,,,
repwestmoreland,377835131962015744,137407124,Twitter Web Client,2013-09-11 16:44:49,3,1,It's been 12 years since the US attacks and 1 year since the Benghazi attack. We will #NeverForget. http://t.co/1ZOBmhPIQm,,,,,
repwestmoreland,377797337390645248,137407124,Twitter Web Client,2013-09-11 14:14:39,0,0,The House is in session today. Click here for the legislative schedule: http://t.co/YzctJ6oSns @HouseFloor,,,,,
repwestmoreland,377793892218699776,137407124,Twitter Web Client,2013-09-11 14:00:57,12,2,"Today we remember those we have lost at home &amp; abroad, &amp; thank our troops who continue to protect us. #NeverForget http://t.co/oP8MmQ56px",,,,,
repwestmoreland,377535003619373056,137407124,Twitter Web Client,2013-09-10 20:52:13,3,0,"ICYMI: @rollcall ""Barack Obama’s Sad Sausage-Making Foreign Policy""",,,,,
repwestmoreland,377498071564697600,137407124,Twitter Web Client,2013-09-10 18:25:28,4,0,"Even Shamu is getting hit by #ObamaCare! SeaWorld to cut hours for nearly 18,000 part-time workers: http://t.co/OGcviQIq40 @HouseCommerce",,,,,
repwestmoreland,377429159397441537,137407124,Twitter Web Client,2013-09-10 13:51:38,5,2,I’m going to vote no on the CR unless it has some definite defunding in there for ObamaCare. Read it in the @thehill: http://t.co/2ya51lYSnW,,,,,
repwestmoreland,377420663452999680,137407124,Twitter Web Client,2013-09-10 13:17:52,4,3,Good morning! The House is back in session. Here's today's legislative schedule: http://t.co/YzctJ6oSns @HouseFloor,,,,,
repwestmoreland,376088440497913856,137407124,Twitter Web Client,2013-09-06 21:04:06,33,19,I've had lots of calls to my offices and want to assure you that I am a NO on military action in #Syria. http://t.co/ptkMMulrsG,,,,,
repwestmoreland,376059443529539584,137407124,Twitter Web Client,2013-09-06 19:08:52,13,6,Where was the #RedLine when four Americans were brutally murdered in #Benghazi? One year later and still no answers. http://t.co/NrexOjBuQL,,,,,
repwestmoreland,373554321486393344,137407124,Twitter Web Client,2013-08-30 21:14:25,5,2,"This weeks Capitol Corner: ""Westmoreland: President Needs Congressional Approval for Strikes on Syria."" Read it HERE: http://t.co/LTklHivHWf",,,,,
repwestmoreland,372776089627553792,137407124,Twitter Web Client,2013-08-28 17:42:00,4,1,Today we honor &amp; remember Dr. King’s historic words &amp; all those who marched for equality 50 years ago. #MarchonWashington,,,,,
repwestmoreland,372709077807153152,137407124,Twitter Web Client,2013-08-28 13:15:43,4,1,"ICYMI: @TimesHerald ""Westmoreland on defunding #ObamaCare"" Read HERE: http://t.co/v1FgXFPV4C",,,,,
repwestmoreland,372456274853511168,137407124,Twitter Web Client,2013-08-27 20:31:10,2,0,I was busy this month in GA's Third District! Check out my Facebook album to see some photos of what I've been up to: http://t.co/rXKobZQNZF,,,,,
repwestmoreland,372379055896526849,137407124,Twitter Web Client,2013-08-27 15:24:20,3,1,Great news from Hyundai! New auto parts/upholstery plant to be built in #GA03 that will create 350 more local #jobs! http://t.co/aVPFd36h6S,,,,,
repwestmoreland,372347505360396288,137407124,Twitter Web Client,2013-08-27 13:18:57,4,1,GA's ports play a crucial role in our state's economic expansion. Read my Capitol Corner on their importance here: http://t.co/IG9LRLiXnK,,,,,
repwestmoreland,370969117802913792,137407124,Twitter for iPhone,2013-08-23 18:01:44,0,0,I'm at the Local Government Grant Workshop at the @fayettechamber. #GA03 http://t.co/IqhesXlsVx,,,,,
repwestmoreland,370604405239730176,137407124,Twitter Web Client,2013-08-22 17:52:30,170,32,"Ive voted nearly 40 times to defund, repeal or delay ObamaCare &amp; have cosponsored 2 more to keep up the fight: http://t.co/wd69zj2Fxl #PJNET",,,,,
repwestmoreland,370565388334952448,137407124,Twitter Web Client,2013-08-22 15:17:28,85,0,"This weeks Capitol Corner: ""Westmoreland Does Not Support Latest #ObamaCare Fix"" Read it here: http://t.co/7IrLULxslH #tcot #PJNET",,,,,
repwestmoreland,370277532613877761,137407124,Camera on iOS,2013-08-21 20:13:37,2,1,Honored to be at the house blessing &amp; dedication of Mildred Johnson's Habitat for Humanity home in Newnan. http://t.co/c4KQiQ4lzn,,,,,
repwestmoreland,370227918385184769,137407124,Twitter for iPhone,2013-08-21 16:56:28,3,2,"Having lunch with Mitch Seabaugh, Jean Peck, and Scott Tigchelaar at Southern Ground to get an update on Senoia. http://t.co/nELvda7HkJ",,,,,
repwestmoreland,370227096687509504,137407124,Twitter for iPhone,2013-08-21 16:53:12,1,0,"At Southern Ground for lunch w/ Jean Peck, the Director of Camp Southern Ground &amp; learning about their camp for kids http://t.co/8WuOGCD0R3",,,,,
repwestmoreland,370216180222423042,137407124,Photos on iOS,2013-08-21 16:09:50,1,1,Thanks to Tencate and their staff for hosting the Manufacturers Round Table today in Senoia! http://t.co/4YFfXk6cd8,,,,,
repwestmoreland,370197417359970305,137407124,Twitter for BlackBerry®,2013-08-21 14:55:16,1,1,"At the Manufacturers Round Table, we're discussing the regulatory burden of the EPA and American energy independence. http://t.co/Wtc79mr1fl",,,,,
repwestmoreland,370194364292943872,137407124,Twitter for iPhone,2013-08-21 14:43:08,3,1,I'm at the Manufacturers Round Table Meeting in Senoia to give an update and talk with local manufacturers. http://t.co/jOWYWp9tu4,,,,,
repwestmoreland,369955786807844864,137407124,Twitter for iPhone,2013-08-20 22:55:07,3,1,Thanks to the @colsgachamber for inviting me to speak at the Legislative Express tonight. http://t.co/aGqvEpi1cz,,,,,
repwestmoreland,369955108832161793,137407124,Twitter for iPhone,2013-08-20 22:52:26,2,0,Full house tonight at the Columbus Chamber Legislative Express! http://t.co/K0clcxuExx,,,,,
repwestmoreland,369875108657393665,137407124,Twitter for iPhone,2013-08-20 17:34:32,2,1,I'm at the Greater Columbus Georgia Chamber of Commerce getting an update the development in the region. http://t.co/7E8MxjOK8Q,,,,,
repwestmoreland,369854823195475968,137407124,Twitter for iPhone,2013-08-20 16:13:56,2,1,I really enjoyed talking to the Young Professionals in Columbus! http://t.co/6IuGeBzO7z,,,,,
repwestmoreland,369584755479941122,137407124,Twitter for iPhone,2013-08-19 22:20:46,2,0,Great crowd tonight at the town hall meeting in Thomaston. Thanks to everyone for stopping by! http://t.co/XayTH2zvRF,,,,,
repwestmoreland,369561533367336960,137407124,Twitter for iPhone,2013-08-19 20:48:30,1,0,Thanks to @GordonState President Max Burns for the campus tour. I enjoyed learning about GSC's progress! http://t.co/n0YPGOPLdq,,,,,
repwestmoreland,369560526755725312,137407124,Twitter for iPhone,2013-08-19 20:44:30,1,0,It was great to meet some alumni and staff of @GordonState! http://t.co/6gXxadqANZ,RepWestmoreland,369540404615475202,,,
repwestmoreland,369540404615475202,137407124,Twitter for iPhone,2013-08-19 19:24:32,2,1,Just finished meeting with the Lamar County Farmers Bureau in Barnesville. Thanks for having me! http://t.co/nkLZW2Tf2b,,,,,
repwestmoreland,369531436568547330,137407124,Twitter for iPhone,2013-08-19 18:48:54,2,2,I enjoyed having lunch with Pike County's elected officials in Zebulon! http://t.co/RDxPFCyHnu,,,,,
repwestmoreland,369517448917041152,137407124,Twitter for iPhone,2013-08-19 17:53:19,3,2,I'm at the Lamar County Farm Bureau in Barnesville giving an update and learning how I can better serve them in DC. http://t.co/MQMHgL902M,,,,,
repwestmoreland,368357859982974980,137407124,Twitter Web Client,2013-08-16 13:05:32,3,2,"On Monday, August 19 I'll be holding another town hall in Thomaston at the R. E. Lee Auditorium from 6-7pm. http://t.co/n7XLvjtWjp",,,,,
repwestmoreland,368006861993148416,137407124,Twitter Web Client,2013-08-15 13:50:47,2,0,RT @rollcall: #howtheyspenttheirsummervacation: Westmoreland (@RepWestmoreland) gets interviewed by @newtgingrich's poli sci prof http://t.…,,,368001682744942593,15922214,rollcall
repwestmoreland,367736115706339329,137407124,Twitter for iPhone,2013-08-14 19:54:57,1,0,I had the pleasure of touring the facility and meeting the employees of Carroll EMC in Carrollton. #GA03 http://t.co/zaNyQhJ8Wo,,,,,
repwestmoreland,367734153686417408,137407124,Twitter for iPhone,2013-08-14 19:47:09,2,1,Thanks to Georgia Arms in Villa Rica for the great tour of your facility today! #GA03 http://t.co/5K1odfJU1E,,,,,
repwestmoreland,367713807323258881,137407124,Twitter for iPhone,2013-08-14 18:26:18,1,0,Just left Sugar Foods Corp. in Villa Rica. Had a great time touring the facility and meeting their staff! http://t.co/LqDoAhuq3F,,,,,
repwestmoreland,367656440401375232,137407124,Twitter Web Client,2013-08-14 14:38:20,2,0,RT @rollcall: Photos: Latest stop in Georgia for @clarkshadows was last night's town hall in Newnan w/ @RepWestmoreland http://t.co/zIyyljO…,,,367650484233842689,15922214,rollcall
repwestmoreland,367655849902088192,137407124,Twitter for iPhone,2013-08-14 14:36:00,2,1,"Being interviewed by Dr Mel Steely, Newt Gingrich's Political Science Professor, at the University of West Georgia. http://t.co/Y6lIephVd0",,,,,
repwestmoreland,367638417536192512,137407124,Twitter for iPhone,2013-08-14 13:26:43,1,0,RT @rettharmon: @RepWestmoreland @dawnbreakers #rotary @GARgovAffairs @RealtorAction @ Sunset Hills Country Club http://t.co/NZa1u49hwR,,,367633408987762689,22440366,rettharmon
repwestmoreland,367637469740535809,137407124,Twitter for iPhone,2013-08-14 13:22:57,2,1,Thanks to the Carroll County Chamber for inviting me to speak at their small business workshop this morning. http://t.co/xhKSHcag3t,,,,,
repwestmoreland,367633109384044546,137407124,Twitter for iPhone,2013-08-14 13:05:38,2,1,I enjoyed attending and speaking at the Carrollton Dawnbreakers Rotary this morning! http://t.co/wEOjQznulS,,,,,
repwestmoreland,367418513629007872,137407124,Twitter for iPhone,2013-08-13 22:52:54,4,0,Thanks to everyone who came to the town hall meeting in Newnan tonight! http://t.co/SGCsleiWFZ,,,,,
repwestmoreland,367024694513246208,137407124,Twitter Web Client,2013-08-12 20:48:00,3,2,"Before August recess, I voted to #StopGovernmentAbuse and to protect Americans from government overreach and waste: http://t.co/NpkTCm34vu",,,,,
repwestmoreland,367005322398818304,137407124,Twitter Web Client,2013-08-12 19:31:02,0,1,I enjoyed chatting with Commissioner Dick Morrow for his radio show in Griffin. Thanks for having me! http://t.co/h8mPNR9W49,,,,,
repwestmoreland,366923325856952320,137407124,Twitter Web Client,2013-08-12 14:05:12,2,0,Thanks to Briggs &amp; Stratton for showing me their engine manufacturing facility in McDonough this morning! http://t.co/Pz3kjt7JWC,,,,,
repwestmoreland,365453619463589888,137407124,Twitter Web Client,2013-08-08 12:45:07,2,1,#AskObamaHousing The #PATHAct is a #ABetterBargain for our nation's housing finance system that meets your principles http://t.co/f6Xe7z2jR9,,,,,
repwestmoreland,364791072251052033,137407124,Twitter Web Client,2013-08-06 16:52:23,5,2,"On August 13, I'll be holding a town hall meeting in Newnan. Click here for more info: http://t.co/MVRo5MaTBp",,,,,
repwestmoreland,364748881143140353,137407124,Twitter Web Client,2013-08-06 14:04:44,1,1,Wishing George W. Bush a healthy and speedy recovery.,,,,,
repwestmoreland,364746240606470144,137407124,Twitter Web Client,2013-08-06 13:54:15,0,0,"Obama: Always a follower, never a leader. House R's already passed the #PATHAct eliminating @FannieMae &amp; @FreddieMac: http://t.co/MkAqiR7pVM",,,,,
repwestmoreland,364731928500375552,137407124,Twitter Web Client,2013-08-06 12:57:22,72,4,"Last week, I voted to #StoptheIRS &amp; get them out of your health care: http://t.co/1v4xYdEsIo #PJNET #tcot",,,,,
repwestmoreland,363334968082042881,137407124,Twitter Web Client,2013-08-02 16:26:21,0,2,"The House passed Keep the IRS Off Your Health Care Act. Health care decisions should be between you &amp; your doctor, not the IRS. #StopTheIRS",,,,,
repwestmoreland,363317543433289729,137407124,Twitter Web Client,2013-08-02 15:17:07,0,1,"With my full support, the House passed the #REINS &amp; the Energy Consumers Relief Act to hold fed agencies accountable: http://t.co/0PakUbyMz9",,,,,
repwestmoreland,363292730757099520,137407124,Twitter Web Client,2013-08-02 13:38:31,7,3,Allowing the IRS to enforce #ObamaCare opens the door to more abuse &amp; harassment of American citizens. #StopTheIRS http://t.co/pjYBLdgZO9,,,,,
repwestmoreland,363005804284092416,137407124,Twitter Web Client,2013-08-01 18:38:22,1,0,Are you getting my weekly e-newsletter? Sign up to learn about what I'm up to in #GA03 and DC: http://t.co/SwmRpvGvJe,,,,,
repwestmoreland,363005018334441472,137407124,Twitter Web Client,2013-08-01 18:35:15,6,2,"As a cosponsor of H.R. 2009, I'm proud to stand with the American people who don't want the IRS in their health care #STOPtheIRS",,,,,
repwestmoreland,362988448816181249,137407124,Twitter Web Client,2013-08-01 17:29:24,1,0,Yesterday @WaysandMeansGOP released an IRS response detailing millions of hours &amp; taxpayer $ spent on union activity: http://t.co/IjWK1wGTNU,,,,,
repwestmoreland,362974676663799808,137407124,Twitter Web Client,2013-08-01 16:34:41,3,0,Thanks to everyone who stopped by to meet with my Field Rep in Barnesville! Stay tuned for more events in August: http://t.co/IqMOlM0V2A,,,,,
repwestmoreland,362966284629061632,137407124,Twitter Web Client,2013-08-01 16:01:20,6,1,Each day we learn more ab how the IRS is unwilling &amp; unable to fairly enforce laws. Why would we trust them with our healthcare? #StopTheIRS,,,,,
repwestmoreland,362960358027165697,137407124,Twitter Web Client,2013-08-01 15:37:47,1,2,VIDEO: Time to dismantle the ObamaCare chaos #FairnessForAll #RepealandReplace http://t.co/YUatpCo1xi,,,,,
repwestmoreland,362948771585355776,137407124,Twitter Web Client,2013-08-01 14:51:45,4,2,Yesterday I was presented with the 2012 FreedomFighter Award. Thanks @FreedomWorks! http://t.co/OYwfWpXtGv http://t.co/Y1Pqvb3Zur,,,,,
repwestmoreland,362929664878063617,137407124,Twitter Web Client,2013-08-01 13:35:49,4,1,"This is why I've voted almost 40 times to defund, dismantle, or repeal the #trainwreck of a law that is #ObamaCare: http://t.co/GQvHpyoZF1",,,,,
repwestmoreland,362917649111449600,137407124,Twitter Web Client,2013-08-01 12:48:04,1,0,Today from 10am-12pm my Field Rep. Theresa will hold open office hours at Mayor Banks office on Merchant Way in Barnesville! Stop by w/ ?'s!,,,,,
repwestmoreland,362669323170480130,137407124,Twitter Web Client,2013-07-31 20:21:19,3,2,"Healthcare decisions should be made by patients, families and doctors - not Washington and especially not the IRS. #StopTheIRS",,,,,
repwestmoreland,362644204112969728,137407124,Twitter Web Client,2013-07-31 18:41:30,3,1,"When it comes to your healthcare decisions, you shouldnt be required to answer to the IRS. Thats why I'm a cosponsor of HR 2009. #StopTheIRS",,,,,
repwestmoreland,362614356103528449,137407124,Twitter Web Client,2013-07-31 16:42:54,4,0,"Tomorrow my field rep, Theresa, will hold an Open Office Day in Barnesville at the Mayor's Office from 10am-Noon. All ?'s welcome!",,,,,
repwestmoreland,362281923785158656,137407124,Twitter Web Client,2013-07-30 18:41:56,7,1,Another Democrat calls out the failures of the President's health care law. #FairnessForAll #FullRepeal http://t.co/rzeBqNDJfr,,,,,
repwestmoreland,362270661709803521,137407124,Twitter Web Client,2013-07-30 17:57:11,0,0,"A special thanks to the Coweta County community, law enforcement &amp; emergency personnel for their dedication to finding Ms Eleanor Alexander.",,,,,
repwestmoreland,362217613658562560,137407124,Twitter Web Client,2013-07-30 14:26:23,1,0,"This August I'll be busy with town halls and events across #GA03. Hope you can stop by! For times &amp; info, click here: http://t.co/MDSZgbL3zL",,,,,
repwestmoreland,360781546191466497,137407124,Twitter Web Client,2013-07-26 15:19:58,3,1,"This past Tuesday, @FinancialCmte held a productive mark-up on the #PATHAct. Read more &amp; watch my remarks here: http://t.co/4xrwJo8uUf",,,,,
repwestmoreland,360781027108589568,137407124,Twitter Web Client,2013-07-26 15:17:54,131,30,Yesterday I voted to protect American energy jobs &amp; coal manufacturers from suffocating EPA regulations: http://t.co/Ufs9CIVXei #PJNET #TCOT,,,,,
repwestmoreland,360405423209189376,137407124,Twitter Web Client,2013-07-25 14:25:23,1,0,Good morning! The House is in session today. Here's the schedule: http://t.co/tDDgqUI4r7,,,,,
repwestmoreland,360095875760005120,137407124,Twitter Web Client,2013-07-24 17:55:21,0,0,VIDEO: Westmoreland discusses the preservation of the 30 year mortgage &amp; home ownership in the #PATHAct. http://t.co/xcMBWORgZ5,,,,,
repwestmoreland,360094429169713152,137407124,Twitter Web Client,2013-07-24 17:49:36,1,0,"VIDEO: Westmoreland challenges ""catfish"" amendment to #PATHAct: ""Here little fishy, I'm gonna gut you."" http://t.co/uRU0yEXZS8",,,,,
repwestmoreland,360092661354467328,137407124,Twitter Web Client,2013-07-24 17:42:35,1,0,RT @GAagribusiness: Enjoyed meetings with @RepWestmoreland @Douglas_Collins @repjohnbarrow &amp; @RepPhilGingrey this morning. #FarmBill #Immig…,,,360082297057329153,36939152,GAagribusiness
repwestmoreland,360060855859167236,137407124,Twitter Web Client,2013-07-24 15:36:12,2,1,"ICYMI: Yesterday, I spoke with @ajconwashington on immigration and the need for strong border security: http://t.co/q1Od7szLTm",,,,,
repwestmoreland,360052753931829248,137407124,Twitter Web Client,2013-07-24 15:04:00,2,0,"ICYMI: @thehill ""Poll: Obama approval nears record low."" Click here for full article: http://t.co/3WS2vzV9vn",,,,,
repwestmoreland,360051158070460417,137407124,Twitter Web Client,2013-07-24 14:57:40,3,0,5% in 2005 vs. 7.6% unemployment in 2013. It's a tale of two trips. #SpeechesDontHire #4Jobs #TCOT http://t.co/2Ruevheqlj,,,,,
repwestmoreland,360049034863443969,137407124,Twitter Web Client,2013-07-24 14:49:13,0,0,Good morning! The House is in session today. Here's the schedule: http://t.co/tDDgqUI4r7 @HouseFloor #TCOT,,,,,
repwestmoreland,359752420676485122,137407124,Twitter Web Client,2013-07-23 19:10:35,15,0,RT @FinancialCmte: The bailout of @FannieMae &amp; @FreddieMac is the costliest taxpayer-funded #bailout in history – nearly $200 billion. http…,,,359749251460395008,42924141,FinancialCmte
repwestmoreland,359724844591484931,137407124,Twitter Web Client,2013-07-23 17:21:00,4,0,HAPPENING NOW: I'm speaking at the @FinancialCmte markup on the #PATHAct. Watch it LIVE: http://t.co/et5fuETgoI,,,,,
repwestmoreland,359679079903002624,137407124,Twitter Web Client,2013-07-23 14:19:09,0,0,HAPPENING NOW: @FinancialCmte markup on #PATHAct. Watch it LIVE: http://t.co/V5eKbRg1qx,,,,,
repwestmoreland,359664095651311616,137407124,Twitter Web Client,2013-07-23 13:19:37,2,0,"TUNE IN: 10am @FinancialCmte begins the markup of H.R. 2767, the #PATHAct. Watch LIVE &amp; learn more here: http://t.co/V5eKbRg1qx",,,,,
repwestmoreland,359663246761930753,137407124,Twitter Web Client,2013-07-23 13:16:14,2,0,Good morning! The House is in session today. Here's the legislative schedule: http://t.co/tDDgqUI4r7 @HouseFloor #TCOT,,,,,
repwestmoreland,359415372295831552,137407124,Twitter Web Client,2013-07-22 20:51:17,7,2,"Ever wonder why a lot of people aren’t McCain fans? After reading these, you shouldn’t: http://t.co/e6s2MpLoWC &amp; http://t.co/v4uYZIqtV9",,,,,
repwestmoreland,359367312782016512,137407124,Twitter Web Client,2013-07-22 17:40:18,55,0,This week's Capitol Corner: House Republicans Unveil Much-Needed Housing Reform: http://t.co/YJ0TGSgsWe @FinancialCmte #PATHAct #PJNET #tcot,,,,,
