user_screen_name,id,user_id,source,created_at,retweet_count,favorite_count,text,in_reply_to_screen_name,in_reply_to_status_id,retweeted_status_id,retweeted_status_user_id,retweeted_status_user_screen_name
senstabenow,302115804080664576,76456274,TweetDeck,2013-02-14 18:03:15,0,2,Northern Michigan Cherry Grower Jeff Send Testifies at Senate Agriculture Committee Hearing http://t.co/oMiAFogZ,,,,,
senstabenow,301424894229479424,76456274,TweetDeck,2013-02-12 20:17:49,6,2,Senate just passed #VAWA by a vote of 78-22. http://t.co/8gn3uUro,,,,,
senstabenow,301423026468179968,76456274,TweetDeck,2013-02-12 20:10:24,3,2,Senator Stabenow Statement on Senate Passage of the Violence Against Women Act: http://t.co/8gn3uUro,,,,,
senstabenow,301377486778949632,76456274,TweetDeck,2013-02-12 17:09:26,2,0,RT @NACWA: .@KKirk_NACWA presents Sen. Stabenow with award for work on biogas at WWTPs and nutrient reduction in #FarmBill. http://t.co/ ...,,,301360702206115840,24878961,NACWA
senstabenow,299963372869390337,76456274,TweetDeck,2013-02-08 19:30:15,2,1,Today's @WashingtonPost - Senator Stabenow's Excellence in #MentalHealth Act http://t.co/91VcRsZz,,,,,
senstabenow,299917372771430400,76456274,TweetDeck,2013-02-08 16:27:28,1,1,Senator Stabenow Applauds Announcement to Make Clean Energy Manufacturing Tax Credits Available to Michigan Companies http://t.co/dIDxXCgw,,,,,
senstabenow,299893656691810304,76456274,TweetDeck,2013-02-08 14:53:14,3,1,This week's Michigan Brief: Senator Stabenow leads effort on #mentalhealth http://t.co/d7X1XoZ1,,,,,
senstabenow,299650909691056128,76456274,TweetDeck,2013-02-07 22:48:39,13,2,Senator Stabenow introducing the Excellence in #MentalHealth Act today with @David_ORussell and advocates. http://t.co/2v5zWdEE,,,,,
senstabenow,299650153776807936,76456274,TweetDeck,2013-02-07 22:45:38,4,0,"Sen. Stabenow joined @David_ORussell, Oscar-nom director of @Silver_Linings Playbook on #mentalhealth bill intro http://t.co/6NC7xPNs",,,,,
senstabenow,299538037443018752,76456274,TweetDeck,2013-02-07 15:20:07,2,1,The @nytimes previews Senator Stabenow's bipartisan Excellence in Mental Health Act: http://t.co/4IodPC4S #mentalhealth,,,,,
senstabenow,292281013483220994,76456274,TweetDeck,2013-01-18 14:43:18,2,0,Senator Stabenow Joins Transportation Secretary LaHood to Announce Support for M-1 Rail: http://t.co/UKi0KvKR,,,,,
senstabenow,290845853227307008,76456274,TweetDeck,2013-01-14 15:40:29,1,1,Senator Stabenow Touts Resurgence of American Auto Industry at North American International Auto Show: http://t.co/ow7OkvFg,,,,,
senstabenow,286961096064114688,76456274,TweetDeck,2013-01-03 22:23:51,4,1,Senator Stabenow was joined by family and friends today as she was sworn in for her third term: http://t.co/kKVZA5G9,,,,,
senstabenow,281443444147232768,76456274,TweetDeck,2012-12-19 16:58:40,1,1,Sen. Stabenow Applauds Treasury Announcement to Sell Remaining GM Stock: http://t.co/ZOgG7Lkn,,,,,
senstabenow,281140787218112512,76456274,TweetDeck,2012-12-18 20:56:01,0,0,"@randallicious Hi, you can get more information on Sen. Stabenow's website - http://t.co/PNgOFJ6i or you can call us (202) 224-4822.",randallicious,281119735150686208,,,
senstabenow,279656863610572801,76456274,TweetDeck,2012-12-14 18:39:26,0,0,Senator Stabenow Applauds Selection of Michigan State University for USDA Bioresearch Grant http://t.co/v5hJhJbT,,,,,
senstabenow,278586674219470849,76456274,TweetDeck,2012-12-11 19:46:53,3,1,Sen. Stabenow Statement on Passage of Right-to-Work Legislation: http://t.co/KrWGuXJo #saveMI,,,,,
senstabenow,278579748551151617,76456274,TweetDeck,2012-12-11 19:19:22,5,1,Sen. Stabenow Statement on Passage of Right-to-Work Legislation: http://t.co/NYE1eNEJ,,,,,
senstabenow,276415776070713345,76456274,TweetDeck,2012-12-05 20:00:31,5,3,Sen. Stabenow Leads Effort Urging House to Pass Tax Cut for Middle-Class Families http://t.co/CrQmlNxP,,,,,
senstabenow,274599671182278656,76456274,TweetDeck,2012-11-30 19:43:58,5,1,"Sen. Stabenow, Sec. Chu, MEDC's Finney: Announcement Cements Michigan's Global Leadership in Advanced Batteries http://t.co/RcBeBQqp",,,,,
senstabenow,274594851172020225,76456274,TweetDeck,2012-11-30 19:24:48,2,1,Sen. Stabenow Hails Opening of New Grayling Veterans Health Clinic http://t.co/nBzWDlb0,,,,,
senstabenow,269155933295362048,76456274,TweetDeck,2012-11-15 19:12:29,7,1,"Sen. Stabenow Applauds Chrysler for Continuing to Invest in Michigan Manufacturing Plants, Create New Michigan Jobs: http://t.co/Zs4UporG",,,,,
senstabenow,266910446420905984,76456274,TweetDeck,2012-11-09 14:29:44,5,1,via @detnews: It's 'back to work' for Stabenow after victory http://t.co/Dad4NSYx #Michigan,,,,,
senstabenow,261839541244162049,76456274,TweetDeck,2012-10-26 14:39:46,1,0,Ag. Chairwoman Stabenow Statement Following Disaster Designation for Bay and Saginaw Counties http://t.co/aQMZymBb,,,,,
senstabenow,258634493907320832,76456274,TweetDeck,2012-10-17 18:24:03,6,0,Agriculture Chairwoman Stabenow Announces Support for Small Businesses in Rural Communities: http://t.co/8WCSq9eU,,,,,
senstabenow,255763521885855744,76456274,TweetDeck,2012-10-09 20:15:50,2,0,Sen. Stabenow Statement Following Discovery of Positive Asian Carp eDNA Samples Beyond Electric Barrier: http://t.co/96m2jYGP,,,,,
senstabenow,254251560354332672,76456274,TweetDeck,2012-10-05 16:07:50,2,0,"Sen. Stabenow: Army Corps' Refusal to Follow Law, Submit Complete Asian Carp Plan 'Unacceptable' http://t.co/zyB5P9jG",,,,,
senstabenow,253579768442785792,76456274,TweetDeck,2012-10-03 19:38:22,1,0,Sen. Stabenow Announces Support for XG Sciences in Lansing http://t.co/T132KIe1,,,,,
senstabenow,253195066741497856,76456274,TweetDeck,2012-10-02 18:09:42,3,0,"Senators Stabenow, Levin Announce Support to Stop Invasive Species http://t.co/fWuSjZ0h",,,,,
senstabenow,252845609772539904,76456274,TweetDeck,2012-10-01 19:01:05,6,1,Agriculture Chairwoman Stabenow Announces Support for Michigan Farmers http://t.co/lybIWDbO,,,,,
senstabenow,250968765225897984,76456274,TweetDeck,2012-09-26 14:43:11,4,0,Senator Stabenow Announces Support for Michigan Law Enforcement http://t.co/6D5sBqa9,,,,,
senstabenow,250627854201667585,76456274,TweetDeck,2012-09-25 16:08:31,5,1,Sen. Stabenow Statement on Discovery of Asian Carp eDNA in Western Lake Erie http://t.co/6dN8NBp6,,,,,
senstabenow,247738820211130368,76456274,TweetDeck,2012-09-17 16:48:32,1,0,Trade Enforcement Unit Championed by Sen. Stabenow Spurs Trade Case Against China: http://t.co/kRG6cVYP,,,,,
senstabenow,245988969555308544,76456274,TweetDeck,2012-09-12 20:55:15,3,0,"Michigan Agriculture Leaders Join Chairwoman Stabenow to Call for a ""Farm Bill Now!"" https://t.co/UjhbgsyT",,,,,
senstabenow,245852761919471616,76456274,TweetDeck,2012-09-12 11:54:00,0,0,Senator Stabenow will be on WKZO in just a minute to talk about the need for a Farm Bill for West #Michigan farmers! http://t.co/kRruDo6o,,,,,
senstabenow,245836088013357057,76456274,TweetDeck,2012-09-12 10:47:45,4,0,"If you're in West Michigan, Sen. Stabenow will be on @wwmtnews Channel 3 in just a few talking about how #Michigan farmers need a #FarmBill.",,,,,
senstabenow,245807421728096257,76456274,Tweetbot for iOS,2012-09-12 08:53:50,1,0,Good morning! Sen Stabenow will be talking about the urgent need for a new #FarmBill at 6:00am with #WakeUpWithAl on the Weather Channel.,,,,,
senstabenow,245534864785436672,76456274,TweetDeck,2012-09-11 14:50:48,2,1,Senator Stabenow Statement on the 11th Anniversary of September 11th: http://t.co/wSM7sNJJ,,,,,
senstabenow,245231115634372608,76456274,TweetDeck,2012-09-10 18:43:48,6,0,Senator Stabenow Cosponsors Legislation to Help Michigan Businesses Hire Veterans http://t.co/6yaZrqP9,,,,,
senstabenow,243415586363826176,76456274,TweetDeck,2012-09-05 18:29:32,6,0,Chairwoman Stabenow: We Need a Farm Bill Now! http://t.co/WSbOnL9Z,,,,,
senstabenow,241166223105204224,76456274,TweetDeck,2012-08-30 13:31:22,8,0,All 83 #Michigan counties declared disaster areas because of #drought. Senator Stabenow's statement: http://t.co/SL1Nkfuw,,,,,
senstabenow,240900525468569600,76456274,TweetDeck,2012-08-29 19:55:35,2,0,Check out Sen. Stabenow's Michigan Brief: Only in America do you see stories like this... http://t.co/7CiESu9B,,,,,
senstabenow,238654909405335552,76456274,TweetDeck,2012-08-23 15:12:19,1,0,Check out this week's Michigan Brief: Stabenow bringing new jobs to Michigan http://t.co/R2rxtaIw,,,,,
senstabenow,236502338133716993,76456274,TweetDeck,2012-08-17 16:38:46,1,0,This week's #Michigan Brief: Lifeline for Michigan's farmers http://t.co/ctHMDSMz #FarmBill #agchat,,,,,
senstabenow,234025877434929152,76456274,TweetDeck,2012-08-10 20:38:11,3,0,Chairwoman Stabenow Applauds USDA Measures to Cut Down on Food Stamp Abuse http://t.co/p2uJtuYe,,,,,
senstabenow,233669848843055104,76456274,TweetDeck,2012-08-09 21:03:27,1,0,"Sen. Stabenow Returns Home to Gladwin, Delivers Keynote at Gladwin County Chamber of Commerce http://t.co/7lOlzwbJ",,,,,
senstabenow,233616711990005761,76456274,TweetDeck,2012-08-09 17:32:19,3,0,"Stabenow's Statewide ""Jobs of the Future"" Tour Continues in Cadillac http://t.co/70Nj97rk",,,,,
senstabenow,228556574250110977,76456274,Twitter Web Client,2012-07-26 18:25:08,0,0,Sen. Stabenow Introduces Bipartisan China Fair Trade Act http://t.co/cZ751lw2,,,,,
senstabenow,226419295876435969,76456274,Twitter Web Client,2012-07-20 20:52:21,1,0,Sen. Stabenow urges President Obama to challenge Japan's anti-competitive trade practices http://t.co/TS0FMvDE,,,,,
senstabenow,226418942762180609,76456274,Twitter Web Client,2012-07-20 20:50:57,1,0,Sen. Stabenow Continues to Stand Up for the American Auto Industry! http://t.co/TS0FMvDE,,,,,
senstabenow,226025938364796928,76456274,Twitter Web Client,2012-07-19 18:49:17,89,4,Sen. Stabenow's Bring Jobs Home Act gets majority vote but is blocked by Republican filibuster: http://t.co/WJIIxFYd,,,,,
senstabenow,225672703762370560,76456274,Twitter Web Client,2012-07-18 19:25:40,5,0,Michigan Business and Labor Leaders join Sen. Stabenow to push for passage of her Bring Jobs Home Act! http://t.co/0FHqr7hW,,,,,
senstabenow,225256281160695809,76456274,Twitter Web Client,2012-07-17 15:50:57,3,0,Senate to consider Stabenow's Bring Jobs Home Act this week http://t.co/4o7vt5yU,,,,,
senstabenow,224989606108602370,76456274,Twitter Web Client,2012-07-16 22:11:16,6,1,Read Senator Stabenow's Statement on the DISCLOSE Act http://t.co/VV0HoPLm,,,,,
senstabenow,223891556103487488,76456274,Twitter Web Client,2012-07-13 21:28:01,2,0,Sen. Stabenow Statement on Discovery of Asian Carp eDNA in Lake Erie http://t.co/Sc8ndkIE,,,,,
senstabenow,223810853215014913,76456274,Twitter Web Client,2012-07-13 16:07:20,0,1,Senator Stabenow Attends Opening of New Elijah J. McCoy Detroit Patent Office http://t.co/K2JchiqP,,,,,
senstabenow,223110868529987584,76456274,Twitter Web Client,2012-07-11 17:45:50,2,0,Read Sen. Stabenow's guest editorial in the Grand Rapids Press! http://t.co/hjuWeiR2,,,,,
senstabenow,222752055339659264,76456274,Twitter Web Client,2012-07-10 18:00:03,0,0,Sen. Stabenow Statement on Air Force Request for Cuts at Selfridge Air National Guard Base http://t.co/pKraEgA6,,,,,
senstabenow,222416676891795457,76456274,Twitter Web Client,2012-07-09 19:47:22,5,1,"Chairwoman Stabenow Visits West Michigan Fruit Farms, Discusses Support for Michigan Growers in Bipartisan Farm Bill http://t.co/12GJRCod",,,,,
senstabenow,220948150314205184,76456274,Twitter Web Client,2012-07-05 18:31:58,2,0,Senator Stabenow Applauds U.S. Challenge to China’s Illegal Duties on American-Made Automobiles http://t.co/4cxDWLea,,,,,
senstabenow,218852437468004352,76456274,Tweetbot for iOS,2012-06-29 23:44:21,2,0,via @GRPress: Asian carp containment strategy for Great Lakes gets a boost from Congress http://t.co/jyevFT1V #Michigan #GreatLakes,,,,,
senstabenow,218848323526860802,76456274,Tweetbot for iOS,2012-06-29 23:28:00,5,0,RT @A4GL: Big win for the #GreatLakes! Legislation to stop #Asiancarp passes Congress. Thanks to @stabenowpress. http://t.co/PiO4ljJq,,,218844985200607232,26778595,A4GL
senstabenow,218848070551617537,76456274,Tweetbot for iOS,2012-06-29 23:27:00,2,0,Stabenow-Camp bill to be signed into law via @Freep: Congress orders Army Corps to speed up Asian carp containment http://t.co/qdLKzhmK,,,,,
senstabenow,218833727780950018,76456274,TweetDeck,2012-06-29 22:30:01,1,0,Montford Point Marines from #Michigan were honored with the Congressional Gold Medal for their heroism and bravery: http://t.co/e7jrMuJO,,,,,
senstabenow,218795978369679360,76456274,TweetDeck,2012-06-29 20:00:00,7,0,Senate passes Stabenow-cosponsored student loan bill: http://t.co/dmvNjzS1 #DontDoubleMyRate,,,,,
senstabenow,218789711924305921,76456274,TweetDeck,2012-06-29 19:35:06,0,0,Honoring the Montford Point Marines: http://t.co/JQtqSgiY,,,,,
senstabenow,218788455503761408,76456274,TweetDeck,2012-06-29 19:30:07,6,1,Stabenow-Camp Legislation to Stop Asian Carp Passes; President to Sign: http://t.co/2ExUtnbs #Michigan,,,,,
senstabenow,218787950085943296,76456274,TweetDeck,2012-06-29 19:28:06,0,0,Legislation to Stop Asian Carp Passes Congress; President to Sign http://t.co/2ExUtnbs #Michigan,,,,,
senstabenow,218457099036934145,76456274,TweetDeck,2012-06-28 21:33:25,2,0,RT @cbsnewsman: Sen. Stabenow wins bipartisan praise for bipartisan bill #farmbill #bipartisanship @MichDems @MIGOP #stabenow http://t.c ...,,,218446104516231168,237840144,cbsnewsman
senstabenow,218057348307095552,76456274,TweetDeck,2012-06-27 19:04:57,5,0,Bipartisan Stabenow Measure to Ensure New Medications are Tested and Safe for Women to Become Law http://t.co/40mH19Mg #women #health,,,,,
senstabenow,218038775824134146,76456274,TweetDeck,2012-06-27 17:51:09,2,0,Senator Stabenow Applauds U.S. Challenge to China’s Illegal Restrictions on Rare Earth Elements http://t.co/MOlwFIVY,,,,,
senstabenow,214728630222327810,76456274,TweetDeck,2012-06-18 14:37:49,9,0,Editorial: A farm bill worth renewing http://t.co/MdfPixW6 via @freep #farmbillnow,,,,,
senstabenow,210777423468433408,76456274,TweetDeck,2012-06-07 16:57:08,1,0,Thanks for your support! RT @AFBFLYNNE: @stabenowpress Thanks for your leadership. #farmbillnow,,,,,
senstabenow,210088478355107840,76456274,TweetDeck,2012-06-05 19:19:31,12,0,"RT @agripulse: ""If congress cannot come together in a bipartisan way and pass #FarmBill it will create tremendous uncertainty and job lo ...",,,210088406838022145,106816456,agripulse
senstabenow,203214556774928384,76456274,Twitter Web Client,2012-05-17 20:05:00,1,0,MT @tedfioraliso: Sen. Stabenow talks to me about her Bring Jobs Home Act ABC 12 News at 5:30 http://t.co/rDDh04QD,,,,,
senstabenow,202887268883640320,76456274,TweetDeck,2012-05-16 22:24:29,6,1,Senator Stabenow calls on Speaker Boehner to pass the Violence Against Women Act: http://t.co/F2OIs43Q #VAWA,,,,,
senstabenow,202042408656044034,76456274,TweetDeck,2012-05-14 14:27:18,5,0,RT @michiganbiz: Debbie Stabenow's jobs bill No. 1 on President Obama's 'to do' list: The president calls on Congress to close co... htt ...,,,202015722103250944,11053412,michiganbiz
senstabenow,200594792491651072,76456274,TweetDeck,2012-05-10 14:35:00,3,0,RT @albioncollege: Sen. Debbie Stabenow took time to grab a photo of @FORDatAlbion students during their DC trip http://t.co/Id8WBH2v,,,200560110379081728,19346558,albioncollege
senstabenow,200322116061634560,76456274,Twitter Web Client,2012-05-09 20:31:28,0,0,@gregmgeorge Will be available soon on THOMAS: http://t.co/wBzvhU3I,gregmgeorge,200289968571154432,,,
senstabenow,199924885340950529,76456274,Twitter Web Client,2012-05-08 18:13:01,11,0,"If Congress Does Not Act by July 1, Stafford Student Loan Interest Rates Will Double for over 300,000 Michigan Students http://t.co/wAWtAgMN",,,,,
senstabenow,199924677462867969,76456274,Twitter Web Client,2012-05-08 18:12:12,2,0,Legislation to Stop Student Loan Interest Rates from Doubling Blocked as Deadline Looms http://t.co/wAWtAgMN,,,,,
senstabenow,199917304484593664,76456274,Twitter Web Client,2012-05-08 17:42:54,1,0,"We need to be exporting our products, not our jobs http://t.co/mJeXAXZb #BringJobsHome",,,,,
senstabenow,199916662504439809,76456274,Twitter Web Client,2012-05-08 17:40:21,6,0,Stabenow’s Bring Jobs Home Act Would End Tax Breaks for Companies that Send Jobs Overseas http://t.co/mJeXAXZb #BringJobsHome,,,,,
senstabenow,199916355640758273,76456274,Twitter Web Client,2012-05-08 17:39:08,11,2,Stabenow’s Bring Jobs Home Act Would Provide 20% Tax Credit to U.S. Companies that Bring Jobs Back to America http://t.co/mJeXAXZb,,,,,
senstabenow,199903430943322112,76456274,Twitter Web Client,2012-05-08 16:47:46,5,1,Army Corps Will Accelerate Efforts to Stop Asian Carp http://t.co/eDHW4PxS #GreatLakes #Michigan,,,,,
senstabenow,199901253160017920,76456274,Twitter Web Client,2012-05-08 16:39:07,12,1,Stabenow Bill to Cut Taxes for Companies Who Move Jobs to U.S. Introduced; @whitehouse Urges Congress to Pass It http://t.co/mJeXAXZb,,,,,
senstabenow,199900730092556289,76456274,Twitter Web Client,2012-05-08 16:37:02,5,0,Widespread Praise for the 2012 Farm Bill http://t.co/XQws07Tq,,,,,
senstabenow,198502433029230593,76456274,Twitter Web Client,2012-05-04 20:00:42,3,0,Stabenow and Camp Call for Action Following Failure of Electronic Asian Carp Barriers: http://t.co/FsWtX4gE #Michigan,,,,,
senstabenow,197075233520361473,76456274,Twitter Web Client,2012-04-30 21:29:31,6,0,Senator Stabenow Unveils New “Bring Jobs Home Act” http://t.co/cE4RCCll,,,,,
senstabenow,195604268688998400,76456274,Twitter Web Client,2012-04-26 20:04:26,3,0,"Agriculture Committee Passes Farm Bill - Stabenow’s Proposal will Reduce Deficit, Eliminate Unnecessary Subsidies http://t.co/Nb9GW6av",,,,,
senstabenow,195602836984299520,76456274,Twitter Web Client,2012-04-26 19:58:45,1,0,"Senate Committee Passes Key Provision Based on Bipartisan Stabenow, Camp Legislation to Stop Asian Carp http://t.co/Uw3Teeg4 #GreatLakes",,,,,
senstabenow,195600606080155648,76456274,Twitter Web Client,2012-04-26 19:49:53,19,0,"RT @SenatorLeahy: @SenateAg JUST PASSED #FarmBill, 16-5. Solid step 4 our economy, natl security, 4 hardworking dairy farmers #VT, 4 all ...",,,195592995230318592,242836537,SenatorLeahy
senstabenow,195528984866455552,76456274,Twitter Web Client,2012-04-26 15:05:17,7,0,"RT @SenateAg: Chairwoman Stabenow: ""The #FarmBill is a jobs bill"" watch markup live now: http://t.co/a32ZEd26",,,195525081584250880,233696188,SenateAg
senstabenow,195528960069734401,76456274,Twitter Web Client,2012-04-26 15:05:11,5,0,RT @SenateAg: Chairwoman Stabenow: There are major reforms in this #FarmBill - cuts deficit by $23 billion - ends direct payments http:/ ...,,,195525726726926336,233696188,SenateAg
senstabenow,195223564926988288,76456274,Twitter Web Client,2012-04-25 18:51:39,2,0,Stabenow Receives Annual Alzheimer's Award http://t.co/kaomivwF http://t.co/vpMqZeKc,,,,,
senstabenow,195173032006914049,76456274,Twitter Web Client,2012-04-25 15:30:51,2,0,RT @MPMorningSun: Stabenow speaks to Alma College grads http://t.co/QpouOAPa,,,193871416469364736,67600528,MPMorningSun
senstabenow,195172505789542400,76456274,Twitter Web Client,2012-04-25 15:28:46,2,0,Sen. Stabenow received an honorary Doctorate of Laws from @almacollege before giving the graduation keynote speech http://t.co/FEpWyaTh,,,,,
senstabenow,193084184288428033,76456274,Twitter Web Client,2012-04-19 21:10:31,8,0,Bipartisan Bill to Stop Asian Carp Introduced http://t.co/SvyNioY7 #GreatLakes,,,,,
senstabenow,192651417335513088,76456274,Twitter Web Client,2012-04-18 16:30:51,2,0,Equal Pay Day Recognizes Hard Work of Michigan Women http://t.co/aXN05k4m,,,,,
senstabenow,192639379905327104,76456274,Twitter Web Client,2012-04-18 15:43:01,2,0,Henry Ford Health System Receives Malcolm Baldrige National Quality Award http://t.co/Jt9ssPqr,,,,,
senstabenow,192635801979457537,76456274,Twitter Web Client,2012-04-18 15:28:48,1,0,"Bio-based Manufacturing, Clean Energy Economy at Midland Area Chamber of Commerce http://t.co/BUUow9kg",,,,,
senstabenow,189452970247716864,76456274,Twitter Web Client,2012-04-09 20:41:22,0,0,"Boosting Exports, Spurring Job Growth, and Increasing Access to Capital for Michigan Small Businesses http://t.co/wJSrfs66",,,,,
senstabenow,189452827255513089,76456274,Twitter Web Client,2012-04-09 20:40:48,3,0,President Signs Law Making Insider Trading Illegal for Members of Congress http://t.co/w44F5cb0,,,,,
senstabenow,185779485990326272,76456274,Twitter Web Client,2012-03-30 17:24:15,2,0,RT @AboutTheLakes: Glad to see Sen. Stabenow on this issue: http://t.co/1MaigjAw,,,185556541934551040,39841218,AboutTheLakes
senstabenow,185415445082419200,76456274,Twitter Web Client,2012-03-29 17:17:41,0,0,Michigan Housing Agencies to Receive Grants for Homeless Veterans http://t.co/JYOCtJmw,,,,,
senstabenow,185065093946552321,76456274,Twitter Web Client,2012-03-28 18:05:31,4,0,Senate Unanimously Passes Stabenow Resolution Opposing Bonuses for MF Global Executives http://t.co/M4qjmC1v,,,,,
senstabenow,184768353729126400,76456274,Twitter for BlackBerry®,2012-03-27 22:26:23,5,0,"Stabenow Opposes Bonuses for MF Global Executives, Introduces Resolution http://t.co/rZV8idFQ",,,,,
senstabenow,182894064444768257,76456274,Twitter Web Client,2012-03-22 18:18:37,7,0,Legislation to prohibit Members of Congress from engaging in insider trading today passed the Senate http://t.co/fHkPg3PS,,,,,
senstabenow,182503806968414208,76456274,Twitter Web Client,2012-03-21 16:27:54,1,0,Michigan Snowmobile Association Honors Stabenow http://t.co/4Mtre5zQ http://t.co/PP7K1yRq,,,,,
senstabenow,181855294924664832,76456274,Twitter Web Client,2012-03-19 21:30:55,3,0,"Stabenow Urges Colleagues to Promote U.S. Exports, New Export-Import Detroit Office in Danger Without Reauthorization http://t.co/Hn5T1Wwn",,,,,
senstabenow,181801714154872834,76456274,Twitter Web Client,2012-03-19 17:58:01,2,1,Stabenow Leads 188 Members Urging President to Confront China on Auto Parts http://t.co/GoMncYjM #jobs,,,,,
senstabenow,180403619512852480,76456274,Twitter Web Client,2012-03-15 21:22:29,1,0,Stabenow Urges Farm Program Reforms http://t.co/uRWtPwzp #agchat,,,,,
senstabenow,180403399039270912,76456274,Twitter Web Client,2012-03-15 21:21:36,3,0,"Stabenow, @SenateAg Members: No bonuses for MF Global Executives http://t.co/cHdg0Lro",,,,,
senstabenow,179974327167496192,76456274,Twitter Web Client,2012-03-14 16:56:38,40,0,RT @Ford: It’s Pi Day: How Will You Celebrate? http://t.co/g2C6oQFr #FordSocial,,,179937346458890241,15676492,Ford
senstabenow,179644583674789888,76456274,Twitter Web Client,2012-03-13 19:06:21,0,1,U.S. Challenges China on Rare Earths http://t.co/Oy6DmkLO,,,,,
senstabenow,179283426355060737,76456274,Twitter Web Client,2012-03-12 19:11:14,1,0,RT @truckingtammy: Support for Stabenow Transportation Bill Amendment http://t.co/eZ8DLs92,,,179090038620028928,71066145,truckingtammy
senstabenow,179273066747142144,76456274,Twitter Web Client,2012-03-12 18:30:04,2,0,RT @AmericanAgNet: ASA applauds Stabenow Bill to expand Biobased Market Program http://t.co/YWGO0eUF,,,179224484740472832,269896114,AmericanAgNet
senstabenow,178191695530295296,76456274,Twitter Web Client,2012-03-09 18:53:05,4,0,"RT @freshenergy: According to @politico, vote on Stabenow amendment to extend wind #PTC will come Tuesday at the earliest http://t.co/Ws ...",,,178162003007905793,18781150,freshenergy
senstabenow,177922227512152066,76456274,TweetDeck,2012-03-09 01:02:19,7,0,"Endorsed by the @uschamber, Stabenow's legislation gives a tax cut to entrepreneurs and innovators http://t.co/Z3zHDFXA #energy #jobs",,,,,
senstabenow,177894261050712065,76456274,Twitter Web Client,2012-03-08 23:11:11,2,0,"Senator Stabenow introduces measure to cut taxes for clean energy companies, job creators http://t.co/Z3zHDFXA #energy #jobs",,,,,
senstabenow,177892088665489408,76456274,Twitter Web Client,2012-03-08 23:02:33,2,1,"Senator Stabenow introduces measure to cut taxes for clean energy companies, job creators http://t.co/Z3zHDFXA",,,,,
senstabenow,177868813721812992,76456274,Twitter Web Client,2012-03-08 21:30:04,3,1,"Stabenow Introduces Measure to Boost Clean Energy Jobs, Michigan Businesses http://t.co/Z3zHDFXA",,,,,
senstabenow,177854405939429376,76456274,Twitter Web Client,2012-03-08 20:32:49,1,0,Sen. Stabenow's amendment endorsed by @uschamber: cuts taxes for clean #energy businesses and job creators. #energy #jobs,,,,,
senstabenow,177837046411436032,76456274,Twitter Web Client,2012-03-08 19:23:50,1,0,Stabenow Leading Effort in Farm Bill to Crack Down on Food Assistance Abuse http://t.co/akRtXWdZ,,,,,
senstabenow,177812845927473152,76456274,Twitter Web Client,2012-03-08 17:47:40,0,0,Stabenow Deeply Concerned about Air National Guard Reductions http://t.co/FRIJGmKe,,,,,
senstabenow,177812673478656000,76456274,Twitter Web Client,2012-03-08 17:46:59,0,0,New Export-Import Office Opening in Detroit http://t.co/vGQW0rBq,,,,,
senstabenow,176725209355792384,76456274,Twitter Web Client,2012-03-05 17:45:47,1,0,Direct Flight from Lansing to D.C. Will Continue http://t.co/tWkiaJ5P,,,,,
senstabenow,175277336567095298,76456274,Twitter Web Client,2012-03-01 17:52:28,3,0,Senate Defeats Blunt Amendment http://t.co/CnJF2o1r,,,,,
senstabenow,174566791891271680,76456274,Twitter Web Client,2012-02-28 18:49:01,0,0,"Here is the updated link http://t.co/ixwNflO9 RT @StabenowPress See the impact of the middle class tax cut we passed today, county by county",SenStabenow,170628346873516034,,,
senstabenow,174563946311852032,76456274,Twitter for Mac,2012-02-28 18:37:42,0,0,"Senator Stabenow has been fighting for tougher trade enforcement since 2005. Today, the President made it happen http://t.co/QRQEKNZW #jobs",,,,,
