user_screen_name,id,user_id,source,created_at,retweet_count,favorite_count,text,in_reply_to_screen_name,in_reply_to_status_id,retweeted_status_id,retweeted_status_user_id,retweeted_status_user_screen_name
senstabenow,553670504520101889,76456274,TweetDeck,2015-01-09 21:51:49,3,2,"Senator Stabenow, @SenGaryPeters Applaud @michiganstateu Role in New High-Tech Manufacturing Hub http://t.co/8Tixicd98w",,,,,
senstabenow,553661950195142656,76456274,Twitter Web Client,2015-01-09 21:17:50,4,3,"Senators Stabenow, Peters Applaud Michigan State University’s Role in New High-Tech Manufacturing Hub http://t.co/8Tixicd98w",,,,,
senstabenow,552925926229811200,76456274,TweetDeck,2015-01-07 20:33:08,1,2,Senator Stabenow Statement on President Obama’s visit to Michigan http://t.co/kKiuZs2l6H,,,,,
senstabenow,552584174746763264,76456274,TweetDeck,2015-01-06 21:55:08,29,44,Joe Biden knows: Michigan's a big deal - the only delegation with two Debbies! http://t.co/XBfSdjXEgg,,,,,
senstabenow,552525717817532417,76456274,TweetDeck,2015-01-06 18:02:51,28,24,Walked Gary Peters down the aisle before he took the oath of office to be Michigan's next Senator! http://t.co/fqlgdN4tc5,,,,,
senstabenow,552521700194406403,76456274,TweetDeck,2015-01-06 17:46:53,3,7,Senator Stabenow Welcomes Gary Peters to U.S. Senate http://t.co/1YOFAUFQjT,,,,,
senstabenow,552200116116156416,76456274,TweetDeck,2015-01-05 20:29:01,1,1,Stabenow Statement on China’s Decision to End Illegal Restrictions on Rare Earth Elements http://t.co/5UxX0C7nAm,,,,,
senstabenow,547124315461001217,76456274,TweetDeck,2014-12-22 20:19:36,1,0,Senator Stabenow Nominates 52 #Michigan Students to Military Academies http://t.co/r0NsZLiXFS,,,,,
senstabenow,546027150051405824,76456274,TweetDeck,2014-12-19 19:39:51,3,4,Senator Stabenow Receives National Association of Community Health Centers Award http://t.co/AtEsNK3RsV,,,,,
senstabenow,545359866693709824,76456274,TweetDeck,2014-12-17 23:28:19,1,3,Agriculture Chairwoman Stabenow Statement on Announcement to Improve U.S.-Cuba Relations http://t.co/IjbujSz9iY,,,,,
senstabenow,545345661919830016,76456274,TweetDeck,2014-12-17 22:31:52,2,0,"Stabenow Statement on Arrest of Owners, Employees Involved with Distributing Tainted Steroids http://t.co/ChDRRvSKgn",,,,,
senstabenow,543533743622086656,76456274,TweetDeck,2014-12-12 22:31:57,6,3,"Senate Passes Stabenow, @MarkUdall Measure to Review Health Services for Military Women http://t.co/pREUypzmx9",,,,,
senstabenow,543271751111938048,76456274,TweetDeck,2014-12-12 05:10:53,1,0,Stabenow Statement on Pension Proposal Attached to Government Funding Bill http://t.co/JsxPfYj3fB,,,,,
senstabenow,542799120654942208,76456274,TweetDeck,2014-12-10 21:52:49,18,14,"As a Michigan State alumna, I am deeply disappointed that George Will is being honored this weekend. http://t.co/ExDVV7ySet",,,,,
senstabenow,542794224224452608,76456274,TweetDeck,2014-12-10 21:33:22,12,3,Stabenow Statement on Michigan State University Decision to Honor George Will at Commencement http://t.co/ExDVV7ySet,,,,,
senstabenow,542359122222792704,76456274,TweetDeck,2014-12-09 16:44:25,1,0,Stabenow Statement on Senate Intelligence Committee Report Detailing the CIA’s Use of Torture http://t.co/dgTkP3qkq8,,,,,
senstabenow,540177591047839744,76456274,TweetDeck,2014-12-03 16:15:48,1,0,Chairwoman Stabenow Convenes U.S. Senate Agriculture Committee Hearing on Water Quality http://t.co/T0PdWenxPs,,,,,
senstabenow,539879216582758400,76456274,TweetDeck,2014-12-02 20:30:10,3,5,Agriculture Chairwoman Stabenow Applauds Investment to Bring Local Food to Michigan Schools http://t.co/4XsJTgKZHR,,,,,
senstabenow,537627904394690560,76456274,TweetDeck,2014-11-26 15:24:15,4,2,Agriculture Chairwoman Stabenow Encourages Dairy Farmers to Enroll in Farm Bill Program Before Next Week’s Deadline http://t.co/UlcCN6Wspk,,,,,
senstabenow,535815741615124480,76456274,TweetDeck,2014-11-21 15:23:22,3,2,Stabenow Statement on Immigration Reform http://t.co/XKnLv1xjT7,,,,,
senstabenow,534766842720825344,76456274,TweetDeck,2014-11-18 17:55:25,18,38,Stabenow Co-Leads Group of 11 Women Senators Urging the Administration to Make Combating Heart Disease a Priority http://t.co/uLTt4Rr2jM,,,,,
senstabenow,534487801480642561,76456274,TweetDeck,2014-11-17 23:26:36,0,3,Stabenow Applauds Senate Passage of Bipartisan Child Care Legislation http://t.co/4v0W8kNLiA,,,,,
senstabenow,534466216262651905,76456274,TweetDeck,2014-11-17 22:00:50,2,2,Were you affected by the August flooding in Southeast Michigan? You now have until Dec. 14 to apply for assistance. http://t.co/xLxabj2Vfn,,,,,
senstabenow,534457336380014592,76456274,TweetDeck,2014-11-17 21:25:33,4,1,"Stabenow, Benishek, Peters Introcude Bill to Stop $100M Increase in Electric Bills for UP Families, Small Businesses http://t.co/oslo9yeRGQ",,,,,
senstabenow,531928801631301632,76456274,TweetDeck,2014-11-10 21:58:03,1,1,Stabenow Statement on Announcement to Award @john_dingell With Nation’s Highest Civilian Honor http://t.co/tvdKkVS1LK,,,,,
senstabenow,524270015332118528,76456274,TweetDeck,2014-10-20 18:44:46,3,3,"Sens. Stabenow, @SenCarlLevin Applaud Great Lakes Restoration Initiative Funding for Western Lake Erie Basin http://t.co/zVSm9xexYH",,,,,
senstabenow,523193589095215105,76456274,Twitter Web Client,2014-10-17 19:27:26,0,3,542 @SBAgov loans have been given to MI families and businesses recovering from August flooding. Check eligibility: http://t.co/bC3UqHIqwM,,,,,
senstabenow,523193531784241153,76456274,Twitter Web Client,2014-10-17 19:27:13,0,3,@SBAgov approved $11M in loans to help MI families and businesses recover after the August floods. Learn how to apply http://t.co/Bi3gfTOKVN,SBAgov,,,,
senstabenow,523172455251070976,76456274,TweetDeck,2014-10-17 18:03:28,5,3,"Sens. Stabenow, Levin Call for Delay of Increase in Electric Bills for Upper Peninsula Families, Small Businesses http://t.co/thZ7AoRr4S",,,,,
senstabenow,519956229666242560,76456274,Twitter Web Client,2014-10-08 21:03:20,1,0,@FEMA opened 4 disaster recovery centers in response to the flooding in SE Michigan. Learn how you can apply for aid. http://t.co/ioC49ShUr8,fema,,,,
senstabenow,519863271370014720,76456274,Twitter Web Client,2014-10-08 14:53:57,9,4,Were you affected by the Southeast Michigan flooding in August? You might be eligible for aid. http://t.co/Bi3gfTOKVN,,,,,
senstabenow,514461881432813568,76456274,Twitter Web Client,2014-09-23 17:10:45,5,2,"Sens. Stabenow, @SenCarlLevin Announce Funding for Michigan State University Food Processing Plant http://t.co/NmqXOpORIZ",,,,,
senstabenow,514141049984270336,76456274,Twitter Web Client,2014-09-22 19:55:53,7,1,"Sen. Stabenow, @SenCarlLevin Announce Nearly $26 Million for New Buses in Detroit http://t.co/YiYlpRRP7j",,,,,
senstabenow,509464646957293569,76456274,Twitter Web Client,2014-09-09 22:13:31,3,4,Michigan Lawmakers Applaud Investment in Detroit’s M-1 RAIL http://t.co/hsNEgu4HSt,,,,,
senstabenow,501738529597444096,76456274,Twitter Web Client,2014-08-19 14:32:41,4,2,Sen. Stabenow Leads Group of 12 Senators Urging Obama Administration to Raise Awareness of Higher Ed Tax Credits http://t.co/BDwjmBiVXf,,,,,
senstabenow,494481625745752064,76456274,Twitter Web Client,2014-07-30 13:56:21,13,11,".@Energy Thanks for having me speak at #Biomass2014! This is good for our #ag industry, #renewables and #sustainability",,,,,
senstabenow,494206512144089088,76456274,Twitter Web Client,2014-07-29 19:43:09,7,7,"We need to make sure that all of our trade agreements are helping us export our products, not our jobs. http://t.co/pe2KPNnn2w",,,,,
senstabenow,494198753361158145,76456274,Twitter Web Client,2014-07-29 19:12:19,2,2,"Today, I’m convening a hearing about the successes and shortcomings of the US-Korea Free Trade Agreement. Tune in: http://t.co/pe2KPNnn2w",,,,,
senstabenow,491332975897112577,76456274,Twitter Web Client,2014-07-21 21:24:44,5,4,Agriculture Chairwoman Stabenow Announces Support for Farmers’ Market in Mt. Pleasant http://t.co/bn8GHaEDSf,,,,,
senstabenow,489490418758078465,76456274,Twitter Web Client,2014-07-16 19:23:04,197,71,Republicans just filibustered a bill to guarantee affordable access to contraception. #HobbyLobby http://t.co/Dzl2NgA5ps,,,,,
senstabenow,481901105333682176,76456274,TweetDeck,2014-06-25 20:45:51,7,6,Sen. Stabenow Appointed Vice Chair of Senate #GreatLakes Task Force http://t.co/6KKNmcNk5C,,,,,
senstabenow,481177624782569472,76456274,TweetDeck,2014-06-23 20:51:00,1,3,Chairwoman Stabenow Announces Support for Two Iosco County Farmers' Markets http://t.co/PhHSwlQsSs,,,,,
senstabenow,479364788863373313,76456274,TweetDeck,2014-06-18 20:47:26,2,3,"Sens. Stabenow, @SenCarlLevin Announce Support for Two Southeast #Michigan Fire Departments http://t.co/ONlaL7jXJv",,,,,
senstabenow,479364392728162304,76456274,TweetDeck,2014-06-18 20:45:52,3,3,"Thanks to #Farmbill, Sens. Stabenow, @SenCarlLevin Announce Millions in PILT Payments for #Michigan Counties http://t.co/XQrIh1Qqub",,,,,
senstabenow,479339188572389376,76456274,TweetDeck,2014-06-18 19:05:42,6,4,"Sens. Stabenow, @SenCarlLevin Urge Sec. @JohnKerry to Protect #GreatLakes http://t.co/LT1MnZP7Hm",,,,,
senstabenow,477208704891490304,76456274,TweetDeck,2014-06-12 21:59:56,3,2,Senator Stabenow Statement on Situation in #Iraq http://t.co/ZBHKHW5e5U,,,,,
senstabenow,477084917097316352,76456274,TweetDeck,2014-06-12 13:48:02,1,2,"Sens. Stabenow, @SenCarlLevin Announce Support for Ironwood Fire Department http://t.co/ku8Lv96jyE",,,,,
senstabenow,477084611865231360,76456274,TweetDeck,2014-06-12 13:46:49,1,2,"Sens. Stabenow, @SenCarlLevin Announce Support for Otsego County Fire Department http://t.co/d3hg70hM9Z",,,,,
senstabenow,477084438619504640,76456274,TweetDeck,2014-06-12 13:46:08,1,2,"Sens. Stabenow, @SenCarlLevin Announce Support for Four Southeast Michigan Fire Departments http://t.co/odNyVw07Aw",,,,,
senstabenow,476846521733120000,76456274,TweetDeck,2014-06-11 22:00:44,3,3,"Senate Passes Bill to Restore Accountability, Reduce Wait Times at the Department of Veterans Affairs http://t.co/Z5WDhY9HWY",,,,,
senstabenow,476820867284865024,76456274,TweetDeck,2014-06-11 20:18:48,1,3,Chairwoman Stabenow Announces Support for Ontonagon County to Buy New Police Vehicle http://t.co/ntFoMeGZuc,,,,,
senstabenow,476795211553595395,76456274,TweetDeck,2014-06-11 18:36:51,2,4,"Sens. Stabenow, @SenCarlLevin Announce Support for Gerald R. Ford International Airport http://t.co/yZZZn4ucH8",,,,,
senstabenow,476794815808413696,76456274,TweetDeck,2014-06-11 18:35:17,3,2,Chairwoman Stabenow Announces Support for Seniors in Clare County http://t.co/RWYcxx5iwJ,,,,,
senstabenow,476734340479873024,76456274,TweetDeck,2014-06-11 14:34:58,8,0,"Republicans Filibuster Bill to Reduce Student Loan Payments of Millions of Americans, Co-Authored by Sen. Stabenow http://t.co/rReZ6FHEOx",,,,,
senstabenow,474965589694640129,76456274,TweetDeck,2014-06-06 17:26:35,8,4,Senate to Vote on Legislation Co-Authored by Sen. Stabenow to Help Address Growing Student Debt Crisis http://t.co/DRssjAoIhp,,,,,
senstabenow,474634162478252033,76456274,TweetDeck,2014-06-05 19:29:37,5,0,"Sens. Stabenow, @SenCarlLevin Announce Tax Credits to Support Economic Development in Michigan http://t.co/7Dur3nxqpg",,,,,
senstabenow,473856228276580352,76456274,TweetDeck,2014-06-03 15:58:23,4,3,"Sen. Stabenow Introduces Bill to Increase Accountability at the VA, Clear Backlog of #Veterans Waiting for Care http://t.co/16a6JxbsXf",,,,,
senstabenow,472439526884126720,76456274,TweetDeck,2014-05-30 18:08:55,5,1,"Sens. Stabenow, @SenCarlLevin Join Dedication of 32,000 Acres of Wilderness at Sleeping Bear Dunes http://t.co/FcCWBvuACN",,,,,
senstabenow,472378818360266752,76456274,TweetDeck,2014-05-30 14:07:41,2,3,"Chairwoman Stabenow Announces Support for #MSU, @MSUExtension to Help Michigan Farmers Access Farm Bill Resources http://t.co/jDm12XWMtU",,,,,
senstabenow,472109032258695171,76456274,TweetDeck,2014-05-29 20:15:39,2,3,"Sens. Stabenow, @SenCarlLevin Announce Support for #GreatLakes Habitat Restoration http://t.co/dCSME5fW7e",,,,,
senstabenow,472091257653972992,76456274,TweetDeck,2014-05-29 19:05:01,2,1,"Sens. Stabenow, @SenCarlLevin Announce Support for North Oakland County Fire Authority http://t.co/Psu3sVS8N0",,,,,
senstabenow,472086656657678336,76456274,TweetDeck,2014-05-29 18:46:44,2,1,Sen. Stabenow Welcomes Department of Energy Announcement on Natural Gas Exports #natgas http://t.co/H71JRqC85L,,,,,
senstabenow,471742335693619201,76456274,TweetDeck,2014-05-28 19:58:32,3,1,"Sens. Stabenow, @SenCarlLevin Announce Support for Ogemaw Fire Department http://t.co/lBDZYAOy0Z",,,,,
senstabenow,469847255009460224,76456274,TweetDeck,2014-05-23 14:28:09,2,0,Chairwoman Stabenow Announces Support for City of Hancock to Buy New Police Vehicle http://t.co/9YZNDocadS,,,,,
senstabenow,469842632135680000,76456274,TweetDeck,2014-05-23 14:09:47,5,0,Sen. Stabenow Announces Victory for American Automakers and Workers in Trade Case Against China http://t.co/ymP7cbSLCg,,,,,
senstabenow,469549491734188032,76456274,TweetDeck,2014-05-22 18:44:57,3,2,"Senate Passes Legislation to Protect and Conserve the Great Lakes, Boost Region's Economy http://t.co/vV9qugf3Ep",,,,,
senstabenow,469117975912787968,76456274,TweetDeck,2014-05-21 14:10:15,4,1,Senator Stabenow Welcomes JPMorgan Chase Investment of $100 Million for Detroit http://t.co/7tf9Ou2aO2,,,,,
senstabenow,468515977492459520,76456274,TweetDeck,2014-05-19 22:18:08,2,3,Sen. Stabenow Applauds US Cyber Espionage Charges Against Chinese Military Officials http://t.co/i7Ns5kr2zo,,,,,
senstabenow,468447922590584832,76456274,TweetDeck,2014-05-19 17:47:42,2,1,"Chairwoman Stabenow Announces Support for City of Bronson to Help Purchase New Police, Public Works Vehicle http://t.co/YhcN8OOAGN",,,,,
senstabenow,467392406741336067,76456274,TweetDeck,2014-05-16 19:53:28,3,3,"Sens. Stabenow, @SenCarlLevin Applaud Efforts to Protect Great Lakes in Water Resources Development Act http://t.co/zNO7AoG6Pu",,,,,
senstabenow,467384953521860608,76456274,TweetDeck,2014-05-16 19:23:51,2,0,Sen. Stabenow Joins Flint Residents to Address Growing Student Debt Crisis http://t.co/h0N3KZhW09,,,,,
senstabenow,467355772436119552,76456274,TweetDeck,2014-05-16 17:27:53,2,1,"Sens. Stabenow, @SenCarlLevin Announce Support for #Detroit Metro Airport Runway Rehabilitation http://t.co/vhBEF1XpOW",,,,,
senstabenow,467320619970076673,76456274,TweetDeck,2014-05-16 15:08:12,2,0,Chairwoman Stabenow Announces Support for First Responders in Lincoln Township http://t.co/tiQGVJImvo,,,,,
senstabenow,467320534595022850,76456274,TweetDeck,2014-05-16 15:07:52,2,0,Chairwoman Stabenow Announces Support for Roscommon Area Schools and First Responders http://t.co/kwm1FFbOsl,,,,,
senstabenow,467320418949677057,76456274,TweetDeck,2014-05-16 15:07:24,2,0,Chairwoman Stabenow Announces Support for Village of Lakeview to Purchase New Police Vehicle http://t.co/6PbOQh5fNa,,,,,
senstabenow,463813166699257856,76456274,TweetDeck,2014-05-06 22:50:50,4,1,"Sen. Stabenow Condemns Kidnapping of Girls by Nigerian Terrorist Group, Calls for Additional International Sanctions http://t.co/DaCoM552kK",,,,,
senstabenow,463704699854929920,76456274,TweetDeck,2014-05-06 15:39:50,9,5,Sen. Stabenow Joins @SenWarren to Introduce Bill to Help Address Growing Student Debt Crisis http://t.co/ObRH7LtPQw,,,,,
senstabenow,463370924046442496,76456274,TweetDeck,2014-05-05 17:33:32,1,0,Sen. Stabenow Announces Support for the City of Clare to Equip Police Vehicles http://t.co/qg7S1aRhUi,,,,,
senstabenow,461547171926769664,76456274,TweetDeck,2014-04-30 16:46:35,6,2,Senate Republicans Block Bill to Raise Minimum Wage for Millions of American Families http://t.co/axkzjjnWeW,,,,,
senstabenow,461534990204157952,76456274,TweetDeck,2014-04-30 15:58:11,8,1,Sen. Stabenow Leads Bipartisan Women Senators Urging Administration to Protect Women's Health http://t.co/QikIhJowo5,,,,,
senstabenow,456810840411234305,76456274,TweetDeck,2014-04-17 15:06:06,7,0,"Sens. Stabenow, @SenCarlLevin Announce Support for Battle Creek Fire Department http://t.co/1sznbauent",,,,,
senstabenow,456795684306296832,76456274,TweetDeck,2014-04-17 14:05:52,7,1,"Chairwoman Stabenow Announces Support for Michigan Fruit, Vegetable and Nursery Producers http://t.co/suZatUacgf",,,,,
senstabenow,456164924759109634,76456274,TweetDeck,2014-04-15 20:19:27,4,1,"Chairwoman Stabenow Urges Michigan Farmers, Ranchers and Growers to Apply for Disaster Assistance http://t.co/8VpvFAansN",,,,,
senstabenow,454297920754692096,76456274,TweetDeck,2014-04-10 16:40:39,19,5,"For people who want a fair shot to go to college, the #GOPBudget pulls the rug out – slashes $90 billion from college funding.",,,,,
senstabenow,454291725180481536,76456274,TweetDeck,2014-04-10 16:16:02,26,7,The Ryan Republican budget RAISES taxes on working people but CUTS taxes for the wealthy and well-connected. That’s not right.,,,,,
senstabenow,454290256016453632,76456274,TweetDeck,2014-04-10 16:10:12,9,2,The Ryan #GOPBudget cancels health insurance plans for millions of Americans – and raises taxes - to pay for tax breaks for the wealthy.,,,,,
senstabenow,454289081762340864,76456274,TweetDeck,2014-04-10 16:05:32,19,3,Like potholes? The House #GOPBudget cuts critical investments in infrastructure like roads and bridges.,,,,,
senstabenow,453924399222370305,76456274,TweetDeck,2014-04-09 15:56:24,5,0,Senate Republicans Block Passage of Paycheck Fairness Act http://t.co/R8W1XfCuMO,,,,,
senstabenow,453570075006865409,76456274,TweetDeck,2014-04-08 16:28:27,4,3,"Sen. Stabenow Statement on Equal Pay Day, Presidential Executive Orders on Equal Pay http://t.co/NuOesR9io1",,,,,
senstabenow,453297158700429314,76456274,TweetDeck,2014-04-07 22:23:59,9,6,Senate Votes to Extend Emergency Unemployment Insurance http://t.co/yQjMahJm8c,,,,,
senstabenow,451432279374442496,76456274,TweetDeck,2014-04-02 18:53:37,11,4,"Families deserve a #fairshot to get ahead, we need to #RaiseTheWage http://t.co/5Dw0RKwr3X",,,,,
senstabenow,451431737709436928,76456274,TweetDeck,2014-04-02 18:51:28,12,10,The $5 a day Henry Ford paid his workers is nearly $15 an hour today #RaiseTheWage http://t.co/Ra3Jv61Vqf,,,,,
senstabenow,451429168756957184,76456274,TweetDeck,2014-04-02 18:41:15,75,28,Henry Ford’s decision to pay his workers $5 a day created the middle class in this country #RaiseTheWage http://t.co/2qkoNV931u,,,,,
senstabenow,451113593858424832,76456274,TweetDeck,2014-04-01 21:47:16,24,11,President Signs Bipartisan Excellence in Mental Health Act Into Law http://t.co/F2eWHNdWY5,,,,,
senstabenow,450777674282455040,76456274,TweetDeck,2014-03-31 23:32:27,7,7,Congress Passes Landmark Step Forward in Community Mental Health Funding http://t.co/TsRKuHTkYw,,,,,
senstabenow,449273462235090944,76456274,TweetDeck,2014-03-27 19:55:15,25,18,Great news! The House was able to come together today in a bipartisan way to strengthen mental health services. http://t.co/sh2HE0MdTk,,,,,
senstabenow,449242911071535104,76456274,TweetDeck,2014-03-27 17:53:51,7,5,House Passes Version of Sen. Stabenow's Bipartisan Excellence in Mental Health Act http://t.co/sh2HE0MdTk,,,,,
senstabenow,449225098516762624,76456274,TweetDeck,2014-03-27 16:43:04,4,1,Senate Passes Ukraine Aid Package http://t.co/xGUWFi4UVd,,,,,
senstabenow,448874478739939328,76456274,TweetDeck,2014-03-26 17:29:50,0,0,WTO Rules in Favor of U.S. Challenge to China's Illegal Restrictions on Rare Earth Elements http://t.co/nYVuMShQqp,,,,,
senstabenow,448216064951083008,76456274,TweetDeck,2014-03-24 21:53:32,7,3,Sen. Stabenow Takes to Senate Floor to Praise Resurgence of American Manufacturing: http://t.co/2waAEU7lnJ,,,,,
senstabenow,446359922213924864,76456274,TweetDeck,2014-03-19 18:57:53,5,1,Chairwoman Stabenow Discusses Farm Bill's Historic Investment in Great Lakes http://t.co/UvuwXuDtsP,,,,,
senstabenow,445948782119616512,76456274,TweetDeck,2014-03-18 15:44:09,4,2,"Chairwoman Stabenow Discusses Implementation of new #FarmBill Investment in Great Lakes, Land Conservation http://t.co/8p8UipzdVE",,,,,
senstabenow,445597934265331712,76456274,TweetDeck,2014-03-17 16:30:01,2,3,Sen. Stabenow Attends Michigan State University's FRIB Groundbreaking http://t.co/AyWoa4TyBd,,,,,
senstabenow,444251233143250944,76456274,TweetDeck,2014-03-13 23:18:42,7,5,"Pres Obama Signs Bill Championed by @SenCarlLevin, Sen Stabenow to Preserve Sleeping Bear Dunes National Lakeshore http://t.co/DAJeOcjpuS",,,,,
senstabenow,443832442148098049,76456274,TweetDeck,2014-03-12 19:34:34,5,2,Sen. Stabenow on the Senate Floor: 1.6 million children in America rely on Child Care &amp; Development Block Grants every month,,,,,
senstabenow,443829558333415425,76456274,TweetDeck,2014-03-12 19:23:07,3,0,"Sens. Stabenow, @SenCarlLevin Announce Support for Range Light Park http://t.co/UpFlt7FIcx",,,,,
senstabenow,443787533810688000,76456274,TweetDeck,2014-03-12 16:36:07,3,0,"Sen. Stabenow, @SenCarlLevin Welcome Senate Confirmation of Michigan Judges http://t.co/3Kys1f0QQV",,,,,
senstabenow,443783122040414208,76456274,TweetDeck,2014-03-12 16:18:36,2,0,"Sens. Stabenow, @SenCarlLevin Announce Support for West Michigan Parks to Increase Accessibility, Expand Facilities http://t.co/gvnL7ISMZ1",,,,,
senstabenow,443781095390457856,76456274,TweetDeck,2014-03-12 16:10:32,2,0,Senate votes 60-37 to confirm Linda V. Parker to U.S. District Court for the Eastern District of Michigan,,,,,
senstabenow,443776528909090816,76456274,TweetDeck,2014-03-12 15:52:24,1,1,Senate votes 98-0 to confirm Laurie Michelson to U.S. District Court for the Eastern District of Michigan,,,,,
senstabenow,443772003309613056,76456274,TweetDeck,2014-03-12 15:34:25,2,0,Senate votes 97-0 to confirm Judith Levy to U.S. District Court for the Eastern District of Michigan,,,,,
senstabenow,443767806707126273,76456274,TweetDeck,2014-03-12 15:17:44,8,7,Senate votes 98-0 to confirm Matthew Leitman to U.S. District Court for the Eastern District of Michigan,,,,,
senstabenow,443101708340977665,76456274,TweetDeck,2014-03-10 19:10:54,3,0,Sen. Stabenow Announces New Communications Director http://t.co/JUMJfsayKu,,,,,
senstabenow,443076576553730048,76456274,TweetDeck,2014-03-10 17:31:02,6,0,"ICYMI: NYT: Sen. Stabenow was ""persistent"" and ""moved purposefully"" to pass the #FarmBill http://t.co/FjzKrGbuK6",,,,,
senstabenow,441599015462121472,76456274,TweetDeck,2014-03-06 15:39:44,2,2,Chairwoman Stabenow Commemorates 100th Anniversary of Cooperative Extension http://t.co/opkOV1kJo9,,,,,
senstabenow,441591126978752512,76456274,TweetDeck,2014-03-06 15:08:23,2,2,Chairwoman Stabenow Announces Tree Restoration Funding for Belle Isle and Detroit http://t.co/46QrLak6Vu,,,,,
senstabenow,440977375539380224,76456274,TweetDeck,2014-03-04 22:29:33,9,5,"Sens. Stabenow, @SenCarlLevin Applaud Final Passage of Bill to Preserve Sleeping Bear Dunes Wilderness http://t.co/loS2BKESiI",,,,,
senstabenow,437980549173747712,76456274,TweetDeck,2014-02-24 16:01:14,3,1,Sen. Stabenow Statement on Announced Retirement of Congressman John Dingell: http://t.co/FIRdmCW8Zo,,,,,
senstabenow,433281416420679680,76456274,TweetDeck,2014-02-11 16:48:34,4,3,"Senators Praise Chairwoman Stabenow's Leadership, Tenacity, Commitment to Bipartisanship on 2014 Farm Bill http://t.co/FWHrTrdtFJ",,,,,
senstabenow,432914096061947904,76456274,TweetDeck,2014-02-10 16:28:58,5,0,Jim Byrum in the Detroit News: A #FarmBill that's right for Michigan: http://t.co/CpoSe3D417,,,,,
senstabenow,430795799266852864,76456274,TweetDeck,2014-02-04 20:11:37,18,5,This is not your father's #FarmBill http://t.co/sjZMmEY8GI,,,,,
senstabenow,430793316624785408,76456274,TweetDeck,2014-02-04 20:01:45,19,9,"The Bipartisan #FarmBill passes, 68-32! Next stop, President Obama! #ag #food #conservation #energy",,,,,
senstabenow,430482167945506817,76456274,TweetDeck,2014-02-03 23:25:21,10,4,Senate Votes to Move Forward on Chairwoman Stabenow's 2014 Farm Bill http://t.co/2bLz2YNpz5,,,,,
senstabenow,428965208674287616,76456274,TweetDeck,2014-01-30 18:57:30,3,0,"Sens. Stabenow, @SenCarlLevin Announce Support for Great Lakes Maritime Academy http://t.co/NqObaFdpjs",,,,,
senstabenow,428628579443044352,76456274,TweetDeck,2014-01-29 20:39:51,2,1,"Sens. Stabenow, @SenCarlLevin Announce Support for Benton Harbor, Muskegon Heights Fire Departments http://t.co/emuyelKp7L",,,,,
senstabenow,428570510163980288,76456274,TweetDeck,2014-01-29 16:49:06,12,4,Chairwoman Stabenow Applauds House Passage of Farm Bill http://t.co/11OAKGVmSu,,,,,
senstabenow,427935459571171328,76456274,TweetDeck,2014-01-27 22:45:38,28,8,Chairwoman Stabenow Announces Bipartisan Agreement on Final Farm Bill http://t.co/xGwfYeYglK,,,,,
senstabenow,426493078913179649,76456274,TweetDeck,2014-01-23 23:14:08,2,2,Sen. Stabenow Joins Michigan Residents in Traverse City to Call for More Action to Stop Asian Carp http://t.co/9UXjmAATOA,,,,,
senstabenow,423884422912290816,76456274,TweetDeck,2014-01-16 18:28:16,6,3,Sen. Stabenow Applauds Selection of @kcollege and @almacollege for National Higher Education Program http://t.co/ofr3H9at3q,,,,,
senstabenow,423549549227937792,76456274,TweetDeck,2014-01-15 20:17:36,6,1,"Sen. Stabenow, @SenCarlLevin Announce Support for Ypsilanti Fire Department to Hire Firefighters http://t.co/6WV5tH27rU",,,,,
senstabenow,423221733793878016,76456274,TweetDeck,2014-01-14 22:34:59,4,2,Sen. Stabenow Statement on Republicans Blocking Senate Vote on Unemployment Insurance http://t.co/0EYHnvl9TB,,,,,
senstabenow,423100809883029504,76456274,TweetDeck,2014-01-14 14:34:28,3,0,"ICYMI: Sen. Stabenow, @SenCarlLevin Announce Full Funding for FRIB Included in 2014 Appropriations Bill http://t.co/scI2oT7a26",,,,,
senstabenow,422828108077494273,76456274,TweetDeck,2014-01-13 20:30:51,3,0,"Sen. Stabenow Statement on Passing of Connie Binsfeld, Former Lt. Governor of Michigan http://t.co/LSRXZWjVXU",,,,,
