user_screen_name,id,user_id,source,created_at,retweet_count,favorite_count,text,in_reply_to_screen_name,in_reply_to_status_id,retweeted_status_id,retweeted_status_user_id,retweeted_status_user_screen_name
senstabenow,34554470905937920,76456274,Twitter Web Client,2011-02-07 10:10:02,4,0,"Senator Stabenow Introduces Bill to Help Spur Advanced Vehicle Sales, Production Today http://go.usa.gov/Ys4 #Autos",,,,,
senstabenow,33288585587343360,76456274,Twitter for BlackBerry®,2011-02-03 22:19:51,1,0,RT @ThisSpudsForYou: Thx to Chair Stabenow and Sen Johanns for successful effort to repeal add'l 1099 burden on farmers yesterday! http: ...,,,33220391493173249,243247252,ThisSpudsForYou
senstabenow,32947007408574464,76456274,Twitter for BlackBerry®,2011-02-02 23:42:33,6,0,RT @AmerMedicalAssn: #AMA AMA Applauds Passage of Stabenow Amendment to Repeal 1099 Reporting Requirement http://bit.ly/hS9pfG,,,32944717775773696,27922157,AmerMedicalAssn
senstabenow,32942759866273792,76456274,Twitter Web Client,2011-02-02 23:25:40,1,0,"Stabenow Initiative Passed, Cuts Red Tape for Small Businesses http://go.usa.gov/YVe",,,,,
senstabenow,32906667314126848,76456274,Twitter Web Client,2011-02-02 21:02:15,5,0,RT @rollcall: RT @DavidMDrucker: Sen Johanns said he expects Stabenow's similar 1099 repeal amendment to pass rather than his. But said ...,,,32855370271563776,15922214,rollcall
senstabenow,32572122731646976,76456274,Twitter Web Client,2011-02-01 22:52:53,0,0,Senator Stabenow Offers Amendment to Cut Red Tape for Small Businesses http://go.usa.gov/YEU #1099,,,,,
senstabenow,32160150332645376,76456274,Twitter Web Client,2011-01-31 19:35:52,0,0,Senator Stabenow Praises President Obama’s Announcement of Startup America Initiative #StartupAmerica http://go.usa.gov/YRy,,,,,
senstabenow,31119732698517504,76456274,Twitter Web Client,2011-01-28 22:41:37,2,0,"RT @9and10News: Sen. Debbie Stabenow visited Northern Michigan today. At 6, she shares a message regarding our veterans.",,,31112138378452993,21036370,9and10News
senstabenow,30685217614200832,76456274,Twitter Web Client,2011-01-27 17:55:00,3,0,Vice President Biden Announces Support for Electric Vehicle Initiatives http://bit.ly/ecCPWs #Autos,,,,,
senstabenow,30426466369937408,76456274,Twitter for BlackBerry®,2011-01-27 00:46:49,3,0,"RT @AP_Ken_Thomas: #Stabenow says fed'l retooling loans helped #Ford modernize Wayne, Mich., plant, says it brought back jobs from Mexic ...",,,30268557484892161,15463486,AP_Ken_Thomas
senstabenow,30108097963892737,76456274,Twitter Web Client,2011-01-26 03:41:44,5,0,Senator Stabenow’s Reaction to President Obama’s State of the Union Address http://stabenow.senate.gov/?p=press_release&id=223,,,,,
senstabenow,30005115276496896,76456274,Twitter Web Client,2011-01-25 20:52:31,2,1,Stabenow bill would drop required IRS filings http://bit.ly/f56uTW (via @freep),,,,,
senstabenow,29963446678196225,76456274,Twitter Web Client,2011-01-25 18:06:57,5,0,"SENATOR: In spirit of bipartisanship, I will be sitting with @SenPatRoberts, my GOP colleague from the Senate Ag Committee, at the #SOTU.",,,,,
senstabenow,28567837689778176,76456274,Twitter Web Client,2011-01-21 21:41:17,1,0,Senator Stabenow Congratulates Jeff Immelt http://bit.ly/eHvfdO,,,,,
senstabenow,28544189188804608,76456274,Twitter Web Client,2011-01-21 20:07:19,3,0,Senator Stabenow Makes Small Businesses Aware of New Tax Cuts http://bit.ly/eV8aPE,,,,,
senstabenow,28534148310237184,76456274,Twitter Web Client,2011-01-21 19:27:25,4,0,Senator Stabenow Calls on House to Pass 1099 Repeal http://stabenow.senate.gov/?p=press_release&id=216 #SmallBiz,,,,,
senstabenow,27480102077992960,76456274,Twitter Web Client,2011-01-18 21:39:01,13,0,RT @ChuckSchumer: Chuck @stabenow @SenSherrodBrown & Sen Casey announce push to pass bill to confront China's currency manipulation http ...,,,27040874667970561,17494010,ChuckSchumer
senstabenow,27471605009481728,76456274,Twitter Web Client,2011-01-18 21:05:15,1,0,RT @ifpti: IFPTI was delighted to have Senator Stabenow come tour our administrative offices and training site this afternoon. http://yf ...,,,27466234652000257,62526424,ifpti
senstabenow,27104794342596608,76456274,Twitter for Mac,2011-01-17 20:47:41,5,0,"Trash Agreement Stops 40,000 Trucks Per Year -- http://t.co/sP5iA64",,,,,
senstabenow,25997400845844480,76456274,Twitter Web Client,2011-01-14 19:27:18,4,0,Welcome to Twitter @ChuckSchumer #ff,,,,,
senstabenow,25974634906128384,76456274,Twitter Web Client,2011-01-14 17:56:50,1,0,Stabenow: We didn't give up on autos http://bit.ly/hHBdwb (via @detnews) #NAIAS,,,,,
senstabenow,25607394608287744,76456274,Twitter Web Client,2011-01-13 17:37:33,0,0,"In Frankenmuth: ""Stabenow is putting politics aside and simply praying for the recovery of her friend and colleague."" http://bit.ly/fawxya",,,,,
senstabenow,25312972024844288,76456274,Twitter Web Client,2011-01-12 22:07:37,1,0,"Stabenow, Levin Announce More Than $1.6 Million for Michigan First Responders http://bit.ly/en81mC",,,,,
senstabenow,25311185343619072,76456274,Twitter Web Client,2011-01-12 22:00:31,0,0,Senator Stabenow Continues Visits to Michigan Agri-businesses http://bit.ly/fwiiYG,,,,,
senstabenow,24858063756333056,76456274,Twitter Web Client,2011-01-11 15:59:58,2,0,Senator Stabenow Gives First Major Address as Agriculture Chairwoman http://bit.ly/hx0kdB,,,,,
senstabenow,23502046032297984,76456274,Twitter Web Client,2011-01-07 22:11:39,1,0,Senator Stabenow Statement on Ford Focus http://bit.ly/fLWQZf,,,,,
senstabenow,23501852326760449,76456274,Twitter Web Client,2011-01-07 22:10:52,1,0,Senator Stabenow Highlights Healthcare Reform Benefits for Seniors http://bit.ly/dRlVPW,,,,,
senstabenow,22073904818298880,76456274,Twitter Web Client,2011-01-03 23:36:43,4,1,Op-Ed in @freep: Stabenow a Champion of Agriculture for Michigan http://bit.ly/exAVnV,,,,,
senstabenow,9723585719435264,76456274,TweetDeck,2010-11-30 21:40:58,0,0,Senator Stabenow Applauds the Launch of GM’s Chevy Volt http://bit.ly/gGAk6c,,,,,
senstabenow,5650903918972928,76456274,TweetDeck,2010-11-19 15:57:35,5,0,Senator Stabenow’s Statement on Becoming Next Chair of the Senate Agriculture Committee http://bit.ly/aRLBwX,,,,,
senstabenow,5392054330859521,76456274,TweetDeck,2010-11-18 22:49:00,2,0,Senator Stabenow Introduces the Protecting Seniors’ Access to Doctors Act http://bit.ly/bjKfUG,,,,,
senstabenow,5384185413898240,76456274,TweetDeck,2010-11-18 22:17:44,1,0,Senator Stabenow Applauds Passage of Asian Carp Import Ban http://bit.ly/9VKUom,,,,,
senstabenow,5004124361850880,76456274,TweetDeck,2010-11-17 21:07:30,0,1,"RT @MICleanEnergy: Sens. Stabenow, Hagan, Udall: #Cleanenergy is the economic key to the 21st Century http://politi.co/dzIhFp",,,,,
senstabenow,4893902943293440,76456274,TweetDeck,2010-11-17 13:49:32,0,0,"Senator Stabenow Congratulates GM, Michigan Workers for Chevy Volt’s ‘Car of the Year’ Honors http://bit.ly/a2ZcGO",,,,,
senstabenow,4657217110282240,76456274,TweetDeck,2010-11-16 22:09:01,1,0,"Stabenow, Levin Congratulate Peter White Public Library http://bit.ly/df1d8L",,,,,
senstabenow,4655707982921728,76456274,TweetDeck,2010-11-16 22:03:01,0,0,"Stabenow, Levin Congratulate West Bloomfield Public Library http://bit.ly/ceaU7w",,,,,
senstabenow,3148707692281856,76456274,TweetDeck,2010-11-12 18:14:45,1,0,RT @freep_politics: Stabenow could be in strong position to help Michigan farmers http://bit.ly/bZo0me,,,3133578145701888,108605625,freep_politics
senstabenow,3148656060403712,76456274,TweetDeck,2010-11-12 18:14:32,1,0,RT @thetimesherald: Stabenow could be in strong position to help Michigan farmers: http://bit.ly/d057Dx,,,3121435354595328,15076670,thetimesherald
senstabenow,2487085860651009,76456274,TweetDeck,2010-11-10 22:25:42,0,0,Senator Stabenow Addresses Port Lansing 2010 Global Logistics Conference http://bit.ly/aHjvLF,,,,,
senstabenow,2104121280696320,76456274,TweetDeck,2010-11-09 21:03:56,4,0,Stabenow Announces Funding to Help Michigan Farmers and Rural Small Businesses Tap Into Clean Energy http://bit.ly/a0xXRy,,,,,
senstabenow,300064652136448,76456274,TweetDeck,2010-11-04 21:35:15,2,0,Stabenow Statement on Passing of Sparky Anderson http://bit.ly/ai5OTm,,,,,
senstabenow,29671001293,76456274,TweetDeck,2010-11-04 14:15:37,0,0,Stabenow Statement After GM Files Initial Public Offering http://bit.ly/cHBoiO,,,,,
senstabenow,29669911764,76456274,TweetDeck,2010-11-04 13:58:05,0,0,Stabenow Announces Site for VA Health Clinic in Cadillac http://bit.ly/dlHM8d,,,,,
senstabenow,29668664716,76456274,TweetDeck,2010-11-04 13:38:30,1,0,"Stabenow Applauds ITC Ruling to Impose Duties Against China & Indonesia for Harming Paper Industry, Michigan Workers http://bit.ly/awauin",,,,,
senstabenow,28723092897,76456274,TweetDeck,2010-10-25 20:38:39,4,0,"Stabenow, Levin: More Than $161 Million Coming for Michigan High Speed Rail http://bit.ly/dkYzlJ",,,,,
senstabenow,28723066753,76456274,TweetDeck,2010-10-25 20:38:14,3,0,Stabenow: Increasing Exports Creates Jobs http://bit.ly/bVykT5,,,,,
senstabenow,28422077644,76456274,TweetDeck,2010-10-22 16:51:48,0,0,"Stabenow, Levin, Klobuchar and Franken Urge Approval of Lansing-Washington Airline Route http://bit.ly/aswayD",,,,,
senstabenow,28421583445,76456274,TweetDeck,2010-10-22 16:45:37,0,0,Stabenow Meets with Houghton Business Owners at Michigan Tech University to Discuss Benefits of Small Business Jobs Act http://bit.ly/9vEqUN,,,,,
senstabenow,27967761525,76456274,TweetDeck,2010-10-20 21:56:27,3,0,Senator Stabenow Calls for an Emergency Increase in Social Security Payments http://bit.ly/aOaBSM,,,,,
senstabenow,27967173752,76456274,TweetDeck,2010-10-20 21:47:54,2,0,Stabenow Applauds $159 Million to Renovate Former Auto Sites http://bit.ly/bfjd2O,,,,,
senstabenow,27144862771,76456274,TweetDeck,2010-10-12 14:44:34,0,0,Stabenow Visits Greater Lansing Business Monthly in Lansing to Discuss the Benefits of the Small Business Jobs Act http://bit.ly/9DmtTs,,,,,
senstabenow,26784109214,76456274,TweetDeck,2010-10-08 20:56:09,0,0,Stabenow Welcomes Bank of America Announcement on Suspension of Foreclosures http://bit.ly/9qnJc4 #Housing,,,,,
senstabenow,26770018988,76456274,TweetDeck,2010-10-08 17:29:01,0,0,Stabenow Meets with Grand Rapids Business Leaders and Owners to Discuss the Benefits of the Small Business Jobs Act http://bit.ly/9xySr7,,,,,
senstabenow,26767622924,76456274,TweetDeck,2010-10-08 16:58:56,0,0,Stabenow Visits Hoffman’s Deco Deli and Café in Flint to Discuss the Benefits of the Small Business Jobs Act http://bit.ly/aePCzk,,,,,
senstabenow,26767600171,76456274,TweetDeck,2010-10-08 16:58:39,0,0,"Stabenow, Huntington, Michigan Manufacturers Association Visit Brown Jig Grinding in Wixom http://bit.ly/9BEF0v #SmallBiz",,,,,
senstabenow,26767420845,76456274,TweetDeck,2010-10-08 16:56:24,0,0,"Stabenow, Levin Announce $18 Million in Loans for Michigan Small Businesses http://bit.ly/cgd0I5",,,,,
senstabenow,26489635177,76456274,TweetDeck,2010-10-05 20:56:09,1,0,Stabenow School-Based Health Center Program to Make $100 Million Available to Michigan Schools http://bit.ly/doucgM,,,,,
senstabenow,26403287207,76456274,TweetDeck,2010-10-04 23:01:01,0,0,"Stabenow: Eastern Market Receives $100,000 to Promote Michigan-Grown Food Choices http://bit.ly/c4lXzi",,,,,
senstabenow,26401334228,76456274,TweetDeck,2010-10-04 22:35:05,0,0,"Stabenow Reinsurance Program to Help 45 Additional Michigan Businesses & Organizations Save Money, Cover Early Retirees http://bit.ly/cpdhOc",,,,,
senstabenow,26398705961,76456274,TweetDeck,2010-10-04 21:59:01,1,0,"Stabenow, Levin Announce More Than $589,000 Grant for Homeless Veterans in Northern Michigan http://bit.ly/cAiIDd",,,,,
senstabenow,26396992626,76456274,TweetDeck,2010-10-04 21:34:25,0,0,Stabenow Conservation Initiative to Provide Greater Land Access to Hunters http://bit.ly/aPGiVm #Michigan,,,,,
senstabenow,26118411318,76456274,TweetDeck,2010-10-01 21:55:06,0,0,Stabenow Statement on Administration’s Fuel Efficiency Announcement http://bit.ly/cY9pCl,,,,,
senstabenow,26043024707,76456274,TweetDeck,2010-10-01 02:59:01,1,0,Stabenow: Northern Michigan Producers Reap Benefits of New Farm Bill Title http://bit.ly/c3DbFN,,,,,
senstabenow,26037623661,76456274,TweetDeck,2010-10-01 01:59:01,0,0,"Stabenow: Genesee, Great Lakes Bay, and Thumb-Area Farmers Reap Benefits of New Farm Bill Title http://bit.ly/aBpCxb #Michigan",,,,,
senstabenow,26032599049,76456274,TweetDeck,2010-10-01 01:00:10,0,0,Stabenow: West Michigan Producers Reap Benefits of New Farm Bill Title http://bit.ly/97vLWR,,,,,
senstabenow,26030273257,76456274,TweetDeck,2010-10-01 00:31:14,1,1,"Stabenow: Eastern Market, Local Farmers Reap Benefits of New Farm Bill Title http://bit.ly/9lITjE #Michigan",,,,,
senstabenow,25938780777,76456274,TweetDeck,2010-09-30 01:52:00,0,0,Stabenow Statement Following House Passage of Currency Legislation http://bit.ly/90P1dH #China #Jobs #Trade,,,,,
senstabenow,25938722740,76456274,TweetDeck,2010-09-30 01:51:16,0,0,"Levin, Stabenow, Dingell Announce $9.48 Million Grant for New University of Michigan Engineering Facility http://bit.ly/cNJRrS",,,,,
senstabenow,25938677302,76456274,TweetDeck,2010-09-30 01:50:43,0,0,"Stabenow, Levin Announce $450,000 for Oakland University’s Business Incubator in Sterling Heights http://bit.ly/9Ab0Ha",,,,,
senstabenow,25918521335,76456274,TweetDeck,2010-09-29 21:25:58,3,0,Senator Stabenow urged the Senate to support the Americans Want to Work Act: http://youtu.be/sdtSm5pl_uQ,,,,,
senstabenow,25903771253,76456274,TweetDeck,2010-09-29 17:43:52,5,0,#S3706- Americans Want to Work Act to be on the Senate floor in the next few hours,,,,,
senstabenow,25828385609,76456274,TweetDeck,2010-09-28 23:00:11,12,0,"Senator Stabenow's bill, #S3706, The Americans Want to Work Act, will be on the Senate floor tomorrow. More info: http://bit.ly/bvf2oU",,,,,
senstabenow,24400540119,76456274,TweetDeck,2010-09-13 17:16:58,3,0,RT @MuskegonChron: Sen. Debbie Stabenow delivers message in Muskegon: Time to rebuild Michigan manufacturing http://bit.ly/dgkXbx,,,24194131962,16926232,MuskegonChron
senstabenow,24038481752,76456274,TweetDeck,2010-09-09 19:47:20,1,0,"Stabenow Meets w/ Agriculture Under Secretary, Michigan Food Processors & Manufacturers to Discuss Export Opportunities http://bit.ly/bDVtLv",,,,,
senstabenow,24017393149,76456274,TweetDeck,2010-09-09 15:05:33,1,1,Stabenow Applauds Efforts of USW to Combat China’s Unfair Trade Tactics http://bit.ly/doXn9o,,,,,
senstabenow,22662154078,76456274,TweetDeck,2010-09-01 00:20:20,1,1,Stabenow Response to President Obama’s Iraq Statement http://bit.ly/bYTj6U,,,,,
senstabenow,22653934887,76456274,TweetDeck,2010-08-31 22:23:36,0,1,Great to see a Grand Rapids company making such a historic contribution - http://nyti.ms/d9HCa1,,,,,
senstabenow,21587859602,76456274,TweetDeck,2010-08-19 15:53:21,1,0,Stabenow Recognizes 90th Anniversary of Women’s Suffrage http://bit.ly/dBK1mp,,,,,
senstabenow,21522690116,76456274,TweetDeck,2010-08-18 21:44:38,1,2,Stabenow Statement After GM Files Proposed Initial Public Offering http://bit.ly/ccTVk1,,,,,
senstabenow,20892883968,76456274,Twitter Web Client,2010-08-11 15:09:15,1,0,Stabenow: Senate Passes Bill to Give More Children Healthy Meals at School http://bit.ly/bHF4A9,,,,,
senstabenow,20340987081,76456274,TweetDeck,2010-08-04 23:11:52,7,1,More information about The Americans Want to Work Act (S.3706) http://stabenow.senate.gov/infocus/AmericansWanttoWork.html,,,,,
senstabenow,20340916894,76456274,TweetDeck,2010-08-04 23:10:47,3,1,"Americans Want to Work Act Co-sponsors @SenatorReid @SenSherrodBrown @ChuckSchumer @SenChrisDodd Durbin, Casey, Levin, Reed, Whitehouse,",,,,,
senstabenow,20340242180,76456274,TweetDeck,2010-08-04 23:00:19,7,0,"Stabenow Introduces Bill 2 Cut Taxes 4 Businesses that Put ppl Back 2 Work, Extend Unemployment Insurance Benefits http://bit.ly/bnK7jZ",,,,,
senstabenow,20173376570,76456274,TweetDeck,2010-08-02 22:45:12,3,0,"Stabenow, Levin: Appropriations Committee Approves $2 Million in Labor, Health Care, & Education Funding for Michigan http://bit.ly/95dtMm",,,,,
senstabenow,19689465969,76456274,TweetDeck,2010-07-27 22:05:14,5,0,Stabenow Statement on Kalamazoo River Oil Spill http://bit.ly/bnE5zM,,,,,
senstabenow,19293080340,76456274,TweetDeck,2010-07-22 23:40:46,4,0,"Stabenow, Levin: Appropriations Committee Approves Over $78 Million 4 MI & Great Lakes in Energy & Water Funding Bill http://bit.ly/ciopxw",,,,,
senstabenow,19292995655,76456274,TweetDeck,2010-07-22 23:39:26,1,0,"Stabenow, Levin: Appropriations Committee Approves Critical Funding for Michigan http://bit.ly/bJoOMK",,,,,
senstabenow,19113458268,76456274,TweetDeck,2010-07-21 23:23:31,4,0,Stabenow: Senate Finally Approves Extension of Unemployment Benefits http://bit.ly/beJV7O #twittermarch,,,,,
senstabenow,19096092474,76456274,TweetDeck,2010-07-21 18:23:21,2,0,Stabenow Joins Pres. Obama as He Signs New Law that Bans Wall Street Bailouts & Gives Consumers Financial Control http://bit.ly/9I9Acr,,,,,
senstabenow,19000107584,76456274,TweetDeck,2010-07-20 15:03:50,1,0,"Stabenow, Brown to Obama: Proposed U.S. Korea Free Trade Agreement Could Undermine Workers, National Export Initiative http://bit.ly/cfUcAc",,,,,
senstabenow,18999395306,76456274,Twitter Web Client,2010-07-20 14:54:18,18,0,'99ers' Left Out of Benefits Extension http://soc.li/mDI4UYb #TwitterMarch,,,,,
senstabenow,18623959946,76456274,TweetDeck,2010-07-15 18:57:53,0,0,RT @congressblog: @TheHill Science says Asian carp are a serious threat to the Great Lakes (Sen. Debbie Stabenow) http://bit.ly/98iAP7,,,,,
senstabenow,18615544794,76456274,TweetDeck,2010-07-15 16:42:04,2,0,Stabenow Announces Support for Supreme Court Nominee Elena Kagan http://bit.ly/9zN612,,,,,
senstabenow,18543317276,76456274,TweetDeck,2010-07-14 19:33:56,4,0,Senator Stabenow Chairs Senate Hearing on Asian Carp - http://bit.ly/f5raX (Live Video) #greatlakes #asiancarp,,,,,
senstabenow,18147898472,76456274,TweetDeck,2010-07-09 21:14:54,1,0,Stabenow Statement Following Treasury Report on Chinese Currency http://bit.ly/atcRwW,,,,,
senstabenow,18147830551,76456274,TweetDeck,2010-07-09 21:13:37,0,0,Stabenow Statement Regarding President Obama’s Planned Visit to LG Chem-Compact Power Battery Plant in Holland http://bit.ly/8YEMuG,,,,,
senstabenow,18138789820,76456274,TweetDeck,2010-07-09 18:30:19,2,0,"Stabenow, Levin Announce Over $5 Million in Funding for Great Lakes Projects http://bit.ly/aBHMBY",,,,,
senstabenow,17966077000,76456274,TweetDeck,2010-07-07 17:35:53,0,0,Stabenow Statement on the Appointment of Michigan Business Leaders to President Obama’s Export Council http://bit.ly/buf9aS,,,,,
senstabenow,17511052445,76456274,TweetDeck,2010-07-01 18:11:41,10,0,RT @ezraklein: Stabenow: ‘To take money from job creation to fund unemployment benefits makes no sense.’ http://bit.ly/9DVGb6,,,17509731210,18622869,ezraklein
senstabenow,17436619903,76456274,TweetDeck,2010-06-30 19:30:58,9,0,Stabenow urges GOP to stop playing politics; stand up for children whose families need #jobless benefits http://bit.ly/d4r8pj #twittermarch,,,,,
senstabenow,17425400027,76456274,TweetDeck,2010-06-30 16:18:23,1,0,Great Lakes Lawmakers Introduce Legislation to Permanently Prevent Asian Carp from Invading the Great Lakes http://bit.ly/asV23r,,,,,
senstabenow,17366319573,76456274,TweetDeck,2010-06-29 22:12:40,1,0,Stabenow-Kerry Early Retiree Reinsurance Program Begins Accepting Applications Today http://bit.ly/dj1idC,,,,,
senstabenow,17364301646,76456274,TweetDeck,2010-06-29 21:35:59,9,0,Senator Stabenow urges colleagues to vote for unemployment insurance: http://youtu.be/Nqh0NRE7WGY #Twittermarch #Tweetmarch,,,,,
senstabenow,17284050923,76456274,TweetDeck,2010-06-28 22:20:21,0,0,Senator Stabenow's Statement on the Passing of Senator Robert Byrd http://bit.ly/972u3g,,,,,
senstabenow,16935163932,76456274,TweetDeck,2010-06-24 14:58:39,0,0,Senator Stabenow Fights to Stop Asian Carp http://youtu.be/QY-Sy12t3qg #GreatLakes,,,,,
senstabenow,16931037466,76456274,TweetDeck,2010-06-24 13:58:33,0,0,Sen. Stabenow speaking on the Senate Floor now pushing for passage of jobs bill and unemployment extension #Michigan #CSPAN2,,,,,
senstabenow,16881729835,76456274,TweetDeck,2010-06-23 22:27:49,0,0,Stabenow Announces $154.4 Million to Aid Hardest Hit in Michigan http://bit.ly/9Yfsws,,,,,
senstabenow,16878905925,76456274,TweetDeck,2010-06-23 21:37:23,0,0,Stabenow Urges Commerce Secretary Gary Locke to Stop Using Taxpayer Money to Purchase Goods Made in China http://bit.ly/dnHb2t,,,,,
senstabenow,16872775800,76456274,TweetDeck,2010-06-23 19:48:47,2,0,"Stabenow calls #AsianCarp find a ""wake up call""-urges Army Corps to close locks while a permanent separation is built http://bit.ly/8WZsAc",,,,,
senstabenow,16871966224,76456274,TweetDeck,2010-06-23 19:35:12,3,0,Stabenow Reaction Following Discovery of Bighead Asian Carp http://bit.ly/8WZsAc #GreatLakes #AsianCarp,,,,,
senstabenow,16807632762,76456274,TweetDeck,2010-06-22 23:47:49,8,0,"RT @DemWarRoom: Stabenow, Casey, @SenJeffMerkley & Whitehouse are on the floor trying to pass an extension of unemployment benefits #UI",,,16807530248,73238146,DemWarRoom
senstabenow,16414712510,76456274,TweetDeck,2010-06-17 20:16:18,1,0,"Stabenow, Levin Announce Over $19 Million in Job Training Funds for Michigan http://bit.ly/9L24AH",,,,,
senstabenow,16410359768,76456274,TweetDeck,2010-06-17 19:06:18,0,0,"Stabenow, Levin Announce More than $6.6 Million for Advanced Energy-Efficient Building Technologies in Michigan http://bit.ly/dyTGJO",,,,,
senstabenow,16337435021,76456274,TweetDeck,2010-06-16 21:45:34,0,0,Stabenow Congratulates Newly-Elected UAW President Bob King http://bit.ly/9yFdVH,,,,,
senstabenow,16324778867,76456274,TweetDeck,2010-06-16 18:02:10,1,0,Stabenow Urges President Obama to Work with Canadian Government to Review Safety of Canadian Wells http://bit.ly/aRoJp7,,,,,
senstabenow,16275194918,76456274,TweetDeck,2010-06-16 02:46:58,1,0,Stabenow Reaction to President Obama’s Oval Office Address http://bit.ly/bQPGQC,,,,,
senstabenow,16275157361,76456274,TweetDeck,2010-06-16 02:46:27,0,0,Stabenow Introduces Senate Resolution to Recognize a “Seniors Bill of Rights” http://bit.ly/dbKsPy,,,,,
senstabenow,15728120463,76456274,TweetDeck,2010-06-08 19:46:29,0,0,Stabenow: Help Coming to Michigan Seniors Reaching Prescription Drug Coverage Gap http://bit.ly/cSCMhC,,,,,
senstabenow,15661142573,76456274,TweetDeck,2010-06-07 22:43:13,0,0,Stabenow Statement on President Obama’s Visit to Kalamazoo Central High School http://bit.ly/c3n0Xk,,,,,
senstabenow,15435033960,76456274,TweetDeck,2010-06-04 18:37:53,1,0,Stabenow Calls on Army Corps to Move Quickly on Plan to Permanently Separate Chicago Waterway System and Great Lakes http://bit.ly/9sZyOO,,,,,
senstabenow,15349384623,76456274,TweetDeck,2010-06-03 20:21:59,0,0,Stabenow: Administration Should Meet with Canadian Officials to Discuss Drilling In Lake Erie http://bit.ly/d4ehjH,,,,,
senstabenow,15334741627,76456274,TweetDeck,2010-06-03 16:00:13,0,0,Stabenow Statement on the Passing of Lucile Belen http://bit.ly/auXyNL,,,,,
senstabenow,15334700742,76456274,TweetDeck,2010-06-03 15:59:37,2,0,Stabenow Urges Major League Baseball Commissioner Bud Selig to Call Galarraga’s Performance a Perfect Game http://bit.ly/aDQzlr,,,,,
senstabenow,14930496514,76456274,TweetDeck,2010-05-28 20:31:46,0,0,House Approves Bipartisan Stabenow-Peters Provision to Create American Jobs and Promote Investment http://bit.ly/dviPfN,,,,,
senstabenow,14863079266,76456274,TweetDeck,2010-05-27 22:22:48,0,0,"Stabenow, Levin Announce $474,000 for Rural Michigan Infrastructure Needs http://bit.ly/9yPRdS",,,,,
senstabenow,14861714720,76456274,TweetDeck,2010-05-27 21:56:28,0,0,Stabenow Introduces Legislation to Help Make Homes More Energy Efficient http://bit.ly/bGKnGL,,,,,
senstabenow,14847121961,76456274,TweetDeck,2010-05-27 17:02:25,0,0,Stabenow Statement Following Asian Carp Regional Coordinating Committee Poisoning Efforts http://bit.ly/bkB3qw,,,,,
senstabenow,14767013717,76456274,TweetDeck,2010-05-26 14:34:37,1,0,Stabenow Welcomes First Lady Michelle Obama to Michigan http://bit.ly/aiHtZM,,,,,
senstabenow,14720186579,76456274,TweetDeck,2010-05-25 22:03:39,0,0,"Stabenow, Levin Join Colleagues in Calling for Authority for Army Corps to Prevent Spread of Asian Carp http://bit.ly/ai4d4E",,,,,
senstabenow,14719818860,76456274,TweetDeck,2010-05-25 21:56:17,0,0,Stabenow Applauds Ford Announcement to Create Clean Energy Jobs in Michigan http://bit.ly/bYm9F3,,,,,
senstabenow,14719466502,76456274,TweetDeck,2010-05-25 21:48:56,0,0,Stabenow Congratulates Michigan Small Business Owners http://bit.ly/bCYA62,,,,,
senstabenow,14445446868,76456274,TweetDeck,2010-05-21 18:32:29,0,0,"Stabenow: Senate Passes Tough Legislation to Hold Wall Street Banks Accountable, Gives Consumers Financial Control http://bit.ly/ddKbbC",,,,,
senstabenow,14443818625,76456274,TweetDeck,2010-05-21 18:00:02,0,0,Stabenow Statement on President Obama’s Meeting on National Fuel-Economy Standards http://bit.ly/bEghul,,,,,
senstabenow,14443795629,76456274,TweetDeck,2010-05-21 17:59:35,1,0,Stabenow: Clean Energy Tax Cuts are Creating Jobs in Michigan According to MEDC http://bit.ly/cp6Beh,,,,,
senstabenow,14255857919,76456274,TweetDeck,2010-05-18 23:03:39,0,0,Stabenow Applauds Redevelopment of Former GM plants http://bit.ly/cVD34r,,,,,
senstabenow,14255841829,76456274,TweetDeck,2010-05-18 23:03:20,1,0,Stabenow Statement After Speaking on Auto Summit Panel Focused on Revitalizing Detroit http://bit.ly/d79ion,,,,,
senstabenow,14176802912,76456274,TweetDeck,2010-05-17 18:37:36,0,0,Stabenow Congratulates Miss USA Rima Fakih http://bit.ly/dBDdrl,,,,,
senstabenow,14176788483,76456274,TweetDeck,2010-05-17 18:37:16,0,0,Stabenow Applauds GM Profits Announcement http://bit.ly/avSz9U,,,,,
